user_input,retrieved_contexts,response,reference,context_precision,context_recall,faithfulness,answer_correctness,answer_relevancy,confidence_score
"What type of students are required to take the are-tracking course in Year 0, Summer of the B.S. Mathematics program?","['ProgramDescription\nTheBachelorofScienceinMathematics(BSMath)degreeprogram“providesstudentswithsubstantialexposure\ntothebreadthanddepthofmathematics,fromclassicaltocontemporary,andfromtheoreticaltoapplied.The\ncurriculumcoversfoundationalcoursesincoreareasofmathematics/appliedmathematicsaswellasadvanced\ncoursesthatwillhelppreparegraduatestopursuehigherstudiesorworkinavarietyoffields”(CMOn.48s.2017,\np.5).\nProgramofStudyforB.S.MathematicsStarting2018\nYear0,Summer\n*are-trackingcourserequiredforthosewhoarenon-completersoftheSHSSTEMstrandorwhohavenottakenandpassedthecalculus-\nrelatedcoursesinSHS\nYear1,Semester1\n*forallincomingcollegefreshmanstudentsandtransfereesexcept(1)thosewhohadfinishedabachelor’sdegreepriortoenrollmentoftheir\npresentcourse,(2)thosewhofinishedseniorhighschoolintheUniversityandhavefinishedthe3Bpurplelevel,and(3)thosewhoseADNU\nentrancetestresultsfallinthe3Blevelofreadingcomprehension\n**requiredonlyfornon-Catholicsand/orgraduatesofnon-Catholicseniorhighschools', '3. They have taken the necessary pre-requisites for the intended Philosophy or\nTheology courses to be enrolled in.\n\nB. Onthe Delivery of Courses. To ensure that the Theology and Philosophy courses\noffered during summer provide the same benefits as when they are taken during\nthe regular semesters, the following conditions shall be implemented:\n\n1. The coverage of these courses when offered in summer shall be the same, if\nnot more substantial, as when they are offered on regular semesters.\n\n2. _Abenchmark syllabus which contains the minimum essentials will be prepared\nby the faculty members (under the supervision of their respective Chairs)\nteaching the course. The faculty can add topics to the benchmark syllabus\nbut not subtract from it.', 'All freshman college students and transferees must finish their reading requirements in two\ncurriculum years based on their earned units. Failure to comply the requirement would mean being\nblocked from taking any major subjects in the following semester and non-re-admittance thereafter.\nK. Withdrawal from or Dropping a Subject', '6. Performance in these courses shall be graded in accordance with the usual\nCollege Grading System of the university. The use of rubrics is a requirement\nfor grading performance in activities that cannot be evaluated using the usual\npaper-and-pencil test, such as reflection papers and participation in outreach.\n\nIV. Effectivity\nThis revised policy and implementing guidelines shall be effective on the Summer\nTerm of 2014 upon the approval by the President.\n120\n| Student Handbook 2025-2026__INSIDE.indd 284 8/20/25 1:44PM |', ""or above, with no grade lower than B in any subject.\n\nThe Dean’s List (College Honors). This list includes all students whose average OPI is 3.40 or\n\nabove, with no failing grade in any subject.\n\nTo qualify for the President's or Dean’s Lists, a student must:\n\na. havea load of at least eighteen (18) curriculum units during the semester,\n\nb. not have been found guilty of intellectual or academic dishonesty and/or discipline cases\nclassified as grave offenses within the semester.\n\n34\n| Student Handbook 2025-2026__INSIDE.indd 198 8/20/25 1:43PM |"", 'classroom management which aids in the effective teaching-learning process in the classroom.\n\nNote: — Previously, attendance was recorded using a beadle’s booklet. Beginning the second semester\nof SY 2024-2025, the university implemented an online Beadle Application to streamline\nattendance tracking and support the paperless initiative.\n\nThe following guidelines and procedures are hereby outlined as aid to teachers in fulfilling their\n\nimportant function.\n\n30\n\n| Student Handbook 2025-2026__INSIDE.indd 194 8/20/25 1:43PM |', '| Course\nCode | CourseTitte | Credit Units |  | Pay u | nits | Pre-Requisite |\n| --- | --- | --- | --- | --- | --- | --- |\n|  |  | lee | lab | lee | lab | Course Course Titte\nCode I |\n| PRAC300 | Practicum (2-40 hours) | 3 | 0 | 3 | 0 | Pass oil Fundamental courses from 1• year to 3""\'\nvear |\n', '12. All official student athletic teams/varsities, publications, and culture and arts groups of the school\nshould submit to OSA their schedule of regular/routinary practice or training not later than two weeks\nafter the start of the semester. The said groups are not required to go through the Student Activity\nApplication process and requirements for their regular practice or training, but they are bound to\nobserve the process and requirements for their activities outside the approved regular schedule\nor off-campus. They are also covered by the Activity Ban Policy (Refer to No. 2 of this Section.).\n\n100\n| Student Handbook 2025-2026__INSIDE.indd 264 8/20/25 1:44PM |']","The students who are required to take the are-tracking course in Year 0, Summer of the B.S. Mathematics program are those who are non-completers of the SHS STEM strand or those who have not taken and passed the calculus-related courses in SHS.",those who are non-completers of the SHS STEM strand or who have not taken and passed the calculus-related courses in SHS,0.9999999999,1.0,0.6666666666666666,0.9267504409011202,,-0.7047876119613647
What is the purpose of integrating Basic Engineering Mathematics into the BSECE program?,"['The BSECE program, with Ignatian ideals, emphasizes core competencies that are essential for ECE\nBraduates. These competencies reflect technical skills and Ignatian values such as problem-solving, design skills,\ncritical thinking, and more. To ensure that these competencies are attained, it is essential to strengthen foundational\nSubjects like mathematics. This will be achieved by integrating Basic Engineering Mathematics into the program.\n\nAdding Basic Engineering Mathematics will allow STEM and non-STEM SHS to Join the program. As an option,\nemerging technology professional electives are included with the demand for new technology. The new professional\nelectives courses will supplement the senior’s projects. In addition to the revision, the course code for Differential\nEquation and Engineering Technopreneurship was changed to align with other engineering programs.\n\na. Program Title and Description', 'a. Program Title and Description\n\nThe Bachelor of Science in Electronics Engineering (BSECE) program is structured to cultivate engineers with a\nrobust grounding in mathematics, natural sciences, physical sciences, and related disciplines. Accordingly, the\nprogram comprises mathematics, science, and engineering fundamentals courses, focusing on nurturing analytical\nand creative skills. It also encompasses language studies, social sciences, humanities, and other core courses to\nensure that graduates are articulate and comprehend the significance of their roles in society and the impact of their\nwork on societal advancement.', 'Ateneo de Naga University\nCollege of Science, Engineering, and Architecture\nElectronics and Computer Engineering Department\nRevised Curriculum for Bachelor of Science In Electronics Engineering (BSECE) S/Y 2024-2025\nBased on CMO No. 101 Serles of 2017\nI. Rationale ,\n\n20 With the integration of outcomes-based, according to the guidelines for implementing CMO No. 46 series of\n\n12 and CMO 37 s. 2012, this curriculum implements the shift to outcomes-based education (OBE), leading to\nCompetency-based standards. This includes the “core competencies” expected of Bachelor of Science in Electronics\nEngineering (BSECE) graduates with Ignatian Ideals.', 'The program equips students with essential engineering tools to tackte challenges in electronics engineering,\nenabling them to pursue diverse career opportunities. Electives are included to facilitate specialization, enabling\nstudents to develop expertise in particular areas. The program also emphasizes fundamental concepts, updating\nexisting courses to reflect new developments.\n\n1', 'ProgramDescription\nTheBachelorofScienceinMathematics(BSMath)degreeprogram“providesstudentswithsubstantialexposure\ntothebreadthanddepthofmathematics,fromclassicaltocontemporary,andfromtheoreticaltoapplied.The\ncurriculumcoversfoundationalcoursesincoreareasofmathematics/appliedmathematicsaswellasadvanced\ncoursesthatwillhelppreparegraduatestopursuehigherstudiesorworkinavarietyoffields”(CMOn.48s.2017,\np.5).\nProgramofStudyforB.S.MathematicsStarting2018\nYear0,Summer\n*are-trackingcourserequiredforthosewhoarenon-completersoftheSHSSTEMstrandorwhohavenottakenandpassedthecalculus-\nrelatedcoursesinSHS\nYear1,Semester1\n*forallincomingcollegefreshmanstudentsandtransfereesexcept(1)thosewhohadfinishedabachelor’sdegreepriortoenrollmentoftheir\npresentcourse,(2)thosewhofinishedseniorhighschoolintheUniversityandhavefinishedthe3Bpurplelevel,and(3)thosewhoseADNU\nentrancetestresultsfallinthe3Blevelofreadingcomprehension\n**requiredonlyfornon-Catholicsand/orgraduatesofnon-Catholicseniorhighschools', 'DepartmentofMathematics,CollegeofScienceandEngineering,AteneodeNagaUniversity\nBachelorofScienceinMathematics(BSMath)RevisedCurriculumSY2018–2019(versionofApril3,2018)\nYear3,Semester2\nYear4,Semester1\nYear4,Semester2\nPage3of21', 'DepartmentofMathematics,CollegeofScienceandEngineering,AteneodeNagaUniversity\nBachelorofScienceinMathematics(BSMath)RevisedCurriculumSY2018–2019(versionofApril3,2018)\nCurriculumRevisionforBachelorofScienceinMathematics(BSMath)\n(basedonCMOn.48s.2017)\nRationale\nThecurriculumoftheBSMathdegreeprogramlasthadamajorrevisionin2008(CMOn.19s.2007).Itwas\nrevisedin2015(MemorandumfromtheChairperson,April23,2015)to""reflecttheshiftortransformationofthe\nexistingundergraduateprogramstolearningcompetencybasedstandards/outcomes-basededucation.""Itisnow\nundergoinganothermajorrevisionfollowingCMOno.48s.2017duetotheadditionoftwoyearstobasiceducation\n(RepublicAct10533,2013),thecreationofanewGeneralEducationCurriculum(CMOn.20s.2013),andthe\nrationalizationofmathematicseducationinthecountry(CommissionenbancResolutionn.231-2017).\nProgramDescription\nTheBachelorofScienceinMathematics(BSMath)degreeprogram“providesstudentswithsubstantialexposure', 'ATENEODENAGAUNIVERSITY\nCollegeofScience,EngineeringandArchitecture\nDepartmentofCivilEngineeringandArchitecture\nCURRICULUMFORBACHELOROFSCIENCEINARCHITECTURE(BSARCH)\nSY2022-2023\nBasedonCMONo.61Seriesof2017\nFIRSTYEAR-FirstSemester\n*Non-Credit,requiredtoallgraduatesofNon-CatholicSHS\nFIRSTYEAR-SecondSemester']","The purpose of integrating Basic Engineering Mathematics into the BSECE program is to strengthen foundational subjects like mathematics, allowing STEM and non-STEM Senior High School graduates to join the program, and to ensure that the core competencies essential for ECE graduates are attained.",to strengthen foundational subjects like mathematics and ensure core competencies are attained,0.999999999975,1.0,0.75,0.6289617401668053,,6.984453201293945
What is the prerequisite for the course MTHR000 Fundamentals of Calculus?,"['| Course code | Course title | Credit\nunits | Pay units\nLec Lab |  | Pre-requisite |  |\n| --- | --- | --- | --- | --- | --- | --- |\n|  |  |  |  | Lab | Course code | Course title |\n| MTHR000* | Fundamentals of Calculus* | (5)* | 5* | 0 |  | (none) |\n| Total |  | 0 | 0+ | 0 |  |  |\n', '| Course code | Course title | Credit\nunits | Pay units |  | Pre-requisite |  |\n| --- | --- | --- | --- | --- | --- | --- |\n|  |  |  | Lec | Lab | Course code | Course title |\n| MTHC241 | Introduction to Real Analysis A | 3 | 3 | 0 | MTHC233 | Calculus C |\n| MTHC115 | Elementary Linear Algebra | 3 | 3 | 0 | MTHC113,\nMTHC221\n(coreq) | Introduction to Abstract\nMathematics, Abstract\nAlgebra A (coreq) |\n| MTHC272 | Theory of Probability | 3 | 3 | 0 | MTHC132,\nMTHC113,\nMTHC233\n(coreq) | Calculus B, Introduction to\nAbstract Mathematics,\nCalculus C (coreq) |\n| MTHC274 | Theory of Statistics | 3 | 3 | 0 | MTHC113,\nMTHC233 | Introduction to Abstract\nMathematics, Calculus C |\n| GENE223 | Fundamentals of Genetics | 3 | 3 | 0 |  | (none) |\n| PHIS102 | Ethics | 3 | 3 | 0 | PHIN102 | Philosophical Anthropology |\n| PEDS104 | Team Sports and Adaptive\nActivities 1 | 2 | 2 | 0 | PEDS101 | Physical Fitness 1 |\n| NSTP102 | National Service Training Program\n(CWTS) II | 3 | 3 | 0 | NSTP101 | National Service Training\nProgram (CWTS) I |\n| CRCP004* | SRA Reading Program 4* | (1.5*) | 1.5* | 0 |  | (none) |\n| Total |  | 23 | 23+ |  |  |  |\n', '| Course code | Course title | Credit\nunits | Pay units |  | Pre-requisite |  |\n| --- | --- | --- | --- | --- | --- | --- |\n|  |  |  | Lec | Lab | Course code | Course title |\n| PHIN102 | Philosophical Anthropology | 3 | 3 | 0 | PHIN101 | Logical and Critical Thinking |\n| MTHC233 | Calculus C | 4 | 4 | 0 | MTHC132 | Calculus B |\n| MTHC221 | Abstract Algebra A | 3 | 3 | 0 | MTHC113 | Introduction to Abstract\nMathematics |\n| GESC213 | General Physics with Calculus\n(Lecture) | 3 | 3 | 0 | MTHC132,\nGESC 214\n(coreq) | Calculus B, General\nPhysics with Calculus\n(Laboratory) |\n| GESC214 | General Physics with Calculus\n(Laboratory) | 1 | 0 | 3 | GESC213\n(coreq) | General Physics with\nCalculus (Lecture) |\n| SOCS101 | Art Appreciation | 3 | 3 | 0 |  | (none) |\n| PEDS103 | Individual/Dual Games and Sports\n1 | 2 | 2 | 0 | PEDS101 | Physical Fitness 1 |\n| NSTP101 | National Service Training Program\n(CWTS) I | 3 | 3 | 0 | CIFP102 | ADNU’s Social Mission and\nFormation |\n| CRCP003* | SRA Reading Program 3* | (1.5*) | 1.5* | 0 |  | (none) |\n| Total |  | 22 | 21+ | 3 |  |  |\n', '| Course\nCode | CourseTitte | Credit Units |  | Pay u | nits | Pre-Requisite |\n| --- | --- | --- | --- | --- | --- | --- |\n|  |  | lee | lab | lee | lab | Course Course Titte\nCode I |\n| PRAC300 | Practicum (2-40 hours) | 3 | 0 | 3 | 0 | Pass oil Fundamental courses from 1• year to 3""\'\nvear |\n', '| Course\nCode | CourseTitte | Credit\nUnits |  | Pay units |  | Pre-Requisite |  |\n| --- | --- | --- | --- | --- | --- | --- | --- |\n|  |  | lee | Lo\nb | Lee | Lab | Course\nCode | CourseTilte |\n| THEN102 | Christian Moral Paradiam | 3 | 0 | 3 | 0 | THEN101 | Christian Discipleship |\n| SOCSl0-4 | The Life and Works of Rizal | 3 | 0 | 3 | 0 | SOCS102 | Readinas In Philiooine History |\n| DEVB321 | Principles of Developmental Biology\n(Lecture) | 3 | 0 | 3 | 0 | PHYS311\nPHYS312 | General Principles of Physiology\n(Lecture)\nGeneral Principles of Physiology\n(laboratory) |\n| DEVB322 | Principles of Developmental Biology\n(Laboratory) | 0 | 2 | 0 | 6 | PHYS311\nPHYS312 | General Principles of Physiology\n(Lecture)\nGeneral Principles of Physiology\nI laboratory] |\n| BPHY321 | Biophysics (Lecture) | 2 | 0 | 2 | 0 | MOLE311\nMOLE312 | Molecular Biology In a living Cell\nllecfurel |\n| BPHY322 | Biophysics (Laboratory) | 0 | 2 | 0 | 6 | MOLE318 | Molecular Biology in a living Cell\nllaboratorvl |\n| SPEC | SoeclaDzation Course I llecturel | 3 | C, | 3 | 0 | Pass all Fundamental courses |  |\n| SPEC | Soeciolizaflon Course I llaboratorvl | 0 | 2 | 0 | 6 | Pass all Fundamental courses |  |\n| RESE391 | Thesis 1 | 2 | 0 | 2 | 0 | Pass all Fundamental courses from 1•• year to 3""\'\nyear first semester |  |\n| TOTAL |  | 16 | 6 | 16 | 18 |  |  |\n', '| Course code | Course title | Credit\nunits | Pay units |  | Pre-requisite |  |\n| --- | --- | --- | --- | --- | --- | --- |\n|  |  |  | Lec | Lab | Course code | Course title |\n| THEN103 | Christian Vocation: Love, Family\nLife, and Society | 3 | 3 | 0 | THEN102 | Christian Moral Paradigm |\n| MTHC299 | Undergraduate Research in\nMathematics | 3 | 3 | 0 |  | (ask advisor) |\n|  | (Qualified elective/Cognate 2) | 3 | 3 | 0 |  |  |\n|  | (Free elective 2) | 3 | 3 | 0 |  |  |\n|  | (GE elective 2) | 3 | 3 | 0 |  |  |\n|  | (GE elective 3) | 3 | 3 | 0 |  |  |\n| Total |  | 18 | 18 | 0 |  |  |\n', ""| pre-| cemrios | Engineering Calculus 1; Differential\nGESC211 | Engineering Physics 1 Lecture Calculus\n[oo | aesc22 | ennerng Ps abr\n; | pre | cemrao1 | Engineering Caiaulus 1: Differential\nGESC212__| Engineering Physics 1 Laboratory Calculus\n[oo | cesc2i | eninstng Pye acre\nBasic Engineering Mathematics\nEngineering Calculus 2: Integral Calculus Engineering Calculus 1: Differential\nCataulus\nPragrarning Lagi ard DES 2 [0 | 6 | eo | perro | erneeing Decree Matin\nes | ee\nfre ™~<“—s*~Ss*sésrti‘aC*~S:Ci‘i( TSSSs;si‘C(i‘'Y’S=C(‘<;$;C<érL;s(< Ss Cd\n*No pre-requisite required if graduated from Catholic SHS\nSECOND YEAR — 15° SEMESTER\ncreo [|_ParUn Co PRE REQUSTE\ncoe [me | tm [ec [us| | Soe | comers\nCODE\neros [ougesas Ci fp [| [fT\nren [Tray [3 [fr |r |r\n. e\n| socsi02_| Reading in Philippine History papa e ft {we | ______\nT__| Ge elective 1 Pe\nrranioa | Pitesti Ativopoioy | 3 | 3 | 0 [PRE | PHONO | lola Cl Ti\n% . . .\nBPE ops cmrarmnns |? | @ | & [re | coro | rrmmatnconon"", '3. They have taken the necessary pre-requisites for the intended Philosophy or\nTheology courses to be enrolled in.\n\nB. Onthe Delivery of Courses. To ensure that the Theology and Philosophy courses\noffered during summer provide the same benefits as when they are taken during\nthe regular semesters, the following conditions shall be implemented:\n\n1. The coverage of these courses when offered in summer shall be the same, if\nnot more substantial, as when they are offered on regular semesters.\n\n2. _Abenchmark syllabus which contains the minimum essentials will be prepared\nby the faculty members (under the supervision of their respective Chairs)\nteaching the course. The faculty can add topics to the benchmark syllabus\nbut not subtract from it.']",The prerequisite for the course MTHR000 Fundamentals of Calculus is (none).,(none),0.9999999999666667,1.0,1.0,0.768613842728221,,3.6549665927886963
What is the basis for the Bachelor of Science in Architecture curriculum for SY 2022-2023?,"[""A new course offering, Bachelor of Science in Architecture, was introduced in the SY\n2022-2023.\nIn 2024, Fr. Aristotle C. Dy was elected as the fifth President of the university. He led the\nStrategic Spiritual Conversations, which laid the groundwork\nms for Strategic Planning 2030. Early in his administration,\nkey institutional structures were established, including\nthose for International Programs and Quality Assurance.\nIX aan New policies were also introduced, such as the revised\nsoy | \\ Laudato Si Materials and Waste Management Program,\n' I which includes a campus-wide plastic ban, and the\nAy ‘AUTONOMOUS comprehensive Safe Space and Safeguarding Policy and\npara Sa urog na pagsirbi Guidelines.\nIn 2025, Ateneo de Naga University, through the\nAteneo MAGIS Technology Business Incubator and the\nCollege of Business and Accountancy, relaunched its entrepreneurship building as the\nMatteo Ricci, SJ Hall, a central hub for students to develop their skills in business and\nentrepreneurship."", 'Ateneo de Naga University\nCollege of Science, Engineering, and Architecture\nElectronics and Computer Engineering Department\nRevised Curriculum for Bachelor of Science In Electronics Engineering (BSECE) S/Y 2024-2025\nBased on CMO No. 101 Serles of 2017\nI. Rationale ,\n\n20 With the integration of outcomes-based, according to the guidelines for implementing CMO No. 46 series of\n\n12 and CMO 37 s. 2012, this curriculum implements the shift to outcomes-based education (OBE), leading to\nCompetency-based standards. This includes the “core competencies” expected of Bachelor of Science in Electronics\nEngineering (BSECE) graduates with Ignatian Ideals.', ""The University < .\nThe class opening schedule will be further moved to & BP Tes IO ca cee\nAugust in 2020. i eae a\nWhen the COVID-19 pandemic struck the count ee oe ees\nPp ry aha a is ea aS (eg N Sa ee\nin 2020, ADNU carried out its instruction and formation ee er L fs\nprograms and services via online flexible learning a Ces: BEV\nmodalities. By the SY 2021-2022, the university poy SG\nimplemented limited face-to-face classes for selected (ome he\nsubjects, following CHED policies and Inter-Agency iy Se.\nTask Force's standards and protocols. LL eS ay\nIn 2021, the Commission on Higher Education a 5 SRS Eee\nrecognized ADNU for its flexible delivery of student\naffairs and services and efficient implementation of the Universal Access to Quality Tertiary\nEducation Act. ADNU also implemented pioneering policies and practices on inclusivity.\nA new course offering, Bachelor of Science in Architecture, was introduced in the SY\n2022-2023."", 'ATENEODENAGAUNIVERSITY\nCollegeofScience,EngineeringandArchitecture\nDepartmentofCivilEngineeringandArchitecture\nCURRICULUMFORBACHELOROFSCIENCEINARCHITECTURE(BSARCH)\nSY2022-2023\nBasedonCMONo.61Seriesof2017\nFIRSTYEAR-FirstSemester\n*Non-Credit,requiredtoallgraduatesofNon-CatholicSHS\nFIRSTYEAR-SecondSemester', 'a. Program Title and Description\n\nThe Bachelor of Science in Electronics Engineering (BSECE) program is structured to cultivate engineers with a\nrobust grounding in mathematics, natural sciences, physical sciences, and related disciplines. Accordingly, the\nprogram comprises mathematics, science, and engineering fundamentals courses, focusing on nurturing analytical\nand creative skills. It also encompasses language studies, social sciences, humanities, and other core courses to\nensure that graduates are articulate and comprehend the significance of their roles in society and the impact of their\nwork on societal advancement.', 'DepartmentofMathematics,CollegeofScienceandEngineering,AteneodeNagaUniversity\nBachelorofScienceinMathematics(BSMath)RevisedCurriculumSY2018–2019(versionofApril3,2018)\nCurriculumRevisionforBachelorofScienceinMathematics(BSMath)\n(basedonCMOn.48s.2017)\nRationale\nThecurriculumoftheBSMathdegreeprogramlasthadamajorrevisionin2008(CMOn.19s.2007).Itwas\nrevisedin2015(MemorandumfromtheChairperson,April23,2015)to""reflecttheshiftortransformationofthe\nexistingundergraduateprogramstolearningcompetencybasedstandards/outcomes-basededucation.""Itisnow\nundergoinganothermajorrevisionfollowingCMOno.48s.2017duetotheadditionoftwoyearstobasiceducation\n(RepublicAct10533,2013),thecreationofanewGeneralEducationCurriculum(CMOn.20s.2013),andthe\nrationalizationofmathematicseducationinthecountry(CommissionenbancResolutionn.231-2017).\nProgramDescription\nTheBachelorofScienceinMathematics(BSMath)degreeprogram“providesstudentswithsubstantialexposure', 'DepartmentofNaturalSciences\nCollegeofScienceandEngineering\nAleneodeNagaUniversity\nBachelorofScienceInEnvlronmentalManagement(BSEM)\nRevisedCurrtculum\nSY2018-2019\nSECONDYEAR1•SEMESTER\nCourse\nCode\nNSCS101\nPHIN102\nECOL211\nECOL212\nECHE211\nECHE212\nELAW121\nPEDS103\nNSTP101\nCRCP003\nSECONDYEAR2""""SEMESTER\nTHIRDYEAR1""SEMESTER\n4', 'FIFTH YEAR - Second Semester\nP hours)\nCourse . Credit a a .\nCode Course Title Units |] Prerequisite | Prerequisite Course Title\nTHEN102 |Christian Moral Paradigm\nTHEN103 |Christian Vocation, Love, Marriage and Family Life 3 3\nPHIN103 |Philosophy of Religion\nProfessional Practice 3\nARCH529 |Business Management & Application for Architecture 2 3 3 ARCH429 |(Global Practice in the\n21st Century)\nARCH523 |Architectural Design 10 - Thesis Research Application 5 | 4 12 | ARCHS13 [AThitectural Design 9 -\nThesis Research Writing\nARCHS  |*Specialization 3 F 3 fat [| ARCHS Specialization 2\n- ao fa Pe fey ey']",The basis for the Bachelor of Science in Architecture curriculum for SY 2022-2023 is CMO No. 61 Series of 2017.,CMO No. 61 Series of 2017,0.249999999975,,,,,5.690059661865234
What is the prerequisite for taking PRAC300 Practicum or On-The-Job Training?,"['| Course\nCode | Course Title | Credit Units Pay units |  |  |  |  |\n| --- | --- | --- | --- | --- | --- | --- |\n|  |  | Lee | Lab | Lee | Lab | Pre-Requisite\nCourse Code I Course Title |\n| PRAC300 | Practicum or On-The-Job Training 3 0\nor equivalence or apprenticeship\n1240 hours) |  |  | 3 | 0 | Pass all Major Subjects |\n', '| Course\nCode | CourseTitte | Credit Units |  | Pay u | nits | Pre-Requisite |\n| --- | --- | --- | --- | --- | --- | --- |\n|  |  | lee | lab | lee | lab | Course Course Titte\nCode I |\n| PRAC300 | Practicum (2-40 hours) | 3 | 0 | 3 | 0 | Pass oil Fundamental courses from 1• year to 3""\'\nvear |\n', '“: { re > CHAPTER 4\n\n¢ — Tests and Quizzes\n\n¢ — Reports or projects\n\n¢ — Student Portfolios\n\n¢ — Class participation\n\n¢ — Oral Presentations\n\n¢ Others (e.g., performance assessment which shall be set by department/cluster or teachers\n\nteaching the course, etc.)\nThe Preliminary, Midterm, Pre-final and the Comprehensive Final Examinations are usually teach-\ner-made summative evaluations, which may be written, oral, practical, etc.\nb. Practicum, Laboratory or Combined Courses\nPercentage of Converted Final Raw Score (CFRS)\nGrading Components\nRegular Semester\nClass Standing 33.33%\n33.33%\n33.33%\n100% 100%', '***NOTE: Upon completion of ALL Computer Networks Professional Electives, students can opt to apply for the following certifications: Cisco\nCertified Networking Associate (CCNA) Routing G Switching Certification\n7', '""s ~ CHAPTER 5\nCollege Admission and Enrollment Procedures\n1. Once the exam result (together with the admission forms, list of admission requirements and\nenrollment dates) is released by the Institutional Testing Office, the applicant must fill out the\napplicable forms and procure the following requirements:\nFor Freshman:\n(One who has graduated from Senior High School or passed an equivalency test which qualifies\nhim/her to enroll in a course leading to a bachelor’s degree. S/He has not taken or stated to\ntake any post-secondary course and intends to take a four or five-year course in the University.)\n1. Original Senior High School Grade 12 Report Card\n2. Certificate of Graduation or Certified True Copy of Senior High School Diploma\n3. Certificate of Good Moral Character (ADNU Form)\nDownload link: tinyurl.com/adnu-cgmc\n4, Original PSA Birth Certificate\n5. One (1) recent 2x2 studio taken picture with white background\n6. Medical Certificate (ADNU Form)', '#*Note: Upon completion of Object - Oriented Programming and Design, students can opt to apply for the following globally ~ recognized Professional\nCertifications: C++ Certified Professional Programmer (CPP) and Python Certified Associate Programmer (PCAP)\n3', 'The PIC shall be a fulltime faculty/staff of the university.\n\nThe PIC should ensure the required PlC-student ratio (1:35-50). Further, there shall be at least\n1 (one) PIC per bus or van.\n\nAll participating students should submit a notarized parents’ permit.\n\nThe application for Student Activity, along with complete requirements, must be accomplished and\nsubmitted to OSA strictly one month before the schedule of tour/trip. Such has to be approved\nby the Vice President for Higher Education, and the Certificate of Compliance must be notarized\nand submitted to CHED.\n\n(For the complete list of requirements and procedures, please refer to the Implementing Rules\nand Regulations for Educational Tours ADNU College Students and Guidelines on Accreditation\nof Tour Agencies for ADNU — College Level)\n\n11. For off-campus activities that entail use/rent of cars, organizers need to submit as requirements', 'Academic Regulations “% .\nThe reckoning of the 18 curriculum units shall include re-tracking/bridging and formation courses,\nNSTP and cross-enrolled courses but excludes SRA.\nThe computation of the average OPI for the semester shall exclude cross-enrolled subjects and\nsubjects that are not graded such as SRA, or those where the grades are just reported as PASS\nor FAIL or their equivalents.\n2. Awards Conferred During Graduation\na. Degree Honors\n1. Degree honors are categorized into Latin honors and Honorable Mention. To qualify for\ndegree honors, a student must have:\na. taken or earned at the Ateneo de Naga University at least 75% of all units required for\nthe degree program’;\nb. earned the required average OPI for the specific degree honors based only on the\ngrades in resident credit units’ and courses required for graduation in the program;\nc. completed the program within the prescribed period of at most six (6)° school years (or']","The prerequisite for taking PRAC300 Practicum or On-The-Job Training is to pass all Major Subjects for BS EM, and to pass all Fundamental courses from 1st year to 3rd year for BS BIO.",Pass all Major Subjects,,,,,,4.356988906860352
What disciplines are the Bachelor of Science in Electronics Engineering program grounded in?,"['a. Program Title and Description\n\nThe Bachelor of Science in Electronics Engineering (BSECE) program is structured to cultivate engineers with a\nrobust grounding in mathematics, natural sciences, physical sciences, and related disciplines. Accordingly, the\nprogram comprises mathematics, science, and engineering fundamentals courses, focusing on nurturing analytical\nand creative skills. It also encompasses language studies, social sciences, humanities, and other core courses to\nensure that graduates are articulate and comprehend the significance of their roles in society and the impact of their\nwork on societal advancement.', 'Ateneo de Naga University\nCollege of Science, Engineering, and Architecture\nElectronics and Computer Engineering Department\nRevised Curriculum for Bachelor of Science In Electronics Engineering (BSECE) S/Y 2024-2025\nBased on CMO No. 101 Serles of 2017\nI. Rationale ,\n\n20 With the integration of outcomes-based, according to the guidelines for implementing CMO No. 46 series of\n\n12 and CMO 37 s. 2012, this curriculum implements the shift to outcomes-based education (OBE), leading to\nCompetency-based standards. This includes the “core competencies” expected of Bachelor of Science in Electronics\nEngineering (BSECE) graduates with Ignatian Ideals.', 'The program equips students with essential engineering tools to tackte challenges in electronics engineering,\nenabling them to pursue diverse career opportunities. Electives are included to facilitate specialization, enabling\nstudents to develop expertise in particular areas. The program also emphasizes fundamental concepts, updating\nexisting courses to reflect new developments.\n\n1', 'The BSECE program, with Ignatian ideals, emphasizes core competencies that are essential for ECE\nBraduates. These competencies reflect technical skills and Ignatian values such as problem-solving, design skills,\ncritical thinking, and more. To ensure that these competencies are attained, it is essential to strengthen foundational\nSubjects like mathematics. This will be achieved by integrating Basic Engineering Mathematics into the program.\n\nAdding Basic Engineering Mathematics will allow STEM and non-STEM SHS to Join the program. As an option,\nemerging technology professional electives are included with the demand for new technology. The new professional\nelectives courses will supplement the senior’s projects. In addition to the revision, the course code for Differential\nEquation and Engineering Technopreneurship was changed to align with other engineering programs.\n\na. Program Title and Description', 'QcPP420 Systems Lecture\nindamentals of Electronic Grasts\nA212\nScare eagn vd Demme | 4 | 3 | 3 | PRE| QCPPIO | Dua stonres agit Acs\nFundamental of Electronic Grasts\nre\nCAD 2: Computer Engineering Drafting Fundamentals of Electronic Circuits\ngacr220 and Design QCPAZ22 Laborato\nQECC101 | CAD 1: Fundamentals of CAD\naie Nd oc\nQcPp350** Development QCPP330 | Data Structures and Algorithm Analysis\n[___| Professional Elective 1 Pa fa fsat fo\nreso fs\n“Note: Upon completion of Operating Systems Concepts and Development, students can opt to apply for a globally - recognized Professional Certification:\nLinux Essentials Professional Development Certificate\n4', 'AteneodeNagaUniversity\nCollegeofScience,EngineeringandArchitecture\nEcE-CpEDepartment\nRevisedCurriculumforBachelorofScienceInComputerEngineering(BSCpE)\n5/Y2025-2026\nBasedonCMO87s2017\nI.RationaleoftheRevision\nTheBachelorofScienceInComputerEngineering(BSCpE)programemphasizescorecompetenciesinthediscipline\nthatareessentialforprofessionalpracticeofCpEgraduates.ThesecompetenciesreflecttechnicalsldllsandIgnatlan\nvaluessuchasproblem-solving,designskills,criticalthinking,andmore.Toensurethatthesecompetenciesareattained,\nitisessentialtostrengthenfoundationalsubjectslikemathematics.Toenhanceopportunitiesforprofessionalpractice,\ntheprofessionalelectivecourses(withinthesametrack)areupdatedandalignedwithindustrydemands,whichalso\nprovidemoreoptionsforseniorprojects.\nTheInclusionofthecourseonBasicEngineeringMathematicsInthecurriculumwlllallowtheadmissionofSTEM\nandnon-STEMSHScompleterstotheprogramtoensureamiculumviability.', 'ATENEODENAGAUNIVERSITY\nCollegeofScience,EngineeringandArchitecture\nDepartmentofCivilEngineeringandArchitecture\nCURRICULUMFORBACHELOROFSCIENCEINARCHITECTURE(BSARCH)\nSY2022-2023\nBasedonCMONo.61Seriesof2017\nFIRSTYEAR-FirstSemester\n*Non-Credit,requiredtoallgraduatesofNon-CatholicSHS\nFIRSTYEAR-SecondSemester', 'DepartmentofMathematics,CollegeofScienceandEngineering,AteneodeNagaUniversity\nBachelorofScienceinMathematics(BSMath)RevisedCurriculumSY2018–2019(versionofApril3,2018)\nYear3,Semester2\nYear4,Semester1\nYear4,Semester2\nPage3of21']","The Bachelor of Science in Electronics Engineering (BSECE) program is grounded in mathematics, natural sciences, physical sciences, and related disciplines.","mathematics, natural sciences, physical sciences, and related disciplines",,,,,,8.729758262634277
What is the basis for the revised curriculum for Bachelor of Science In Electronics Engineering for S/Y 2024-2025?,"['Ateneo de Naga University\nCollege of Science, Engineering, and Architecture\nElectronics and Computer Engineering Department\nRevised Curriculum for Bachelor of Science In Electronics Engineering (BSECE) S/Y 2024-2025\nBased on CMO No. 101 Serles of 2017\nI. Rationale ,\n\n20 With the integration of outcomes-based, according to the guidelines for implementing CMO No. 46 series of\n\n12 and CMO 37 s. 2012, this curriculum implements the shift to outcomes-based education (OBE), leading to\nCompetency-based standards. This includes the “core competencies” expected of Bachelor of Science in Electronics\nEngineering (BSECE) graduates with Ignatian Ideals.', 'a. Program Title and Description\n\nThe Bachelor of Science in Electronics Engineering (BSECE) program is structured to cultivate engineers with a\nrobust grounding in mathematics, natural sciences, physical sciences, and related disciplines. Accordingly, the\nprogram comprises mathematics, science, and engineering fundamentals courses, focusing on nurturing analytical\nand creative skills. It also encompasses language studies, social sciences, humanities, and other core courses to\nensure that graduates are articulate and comprehend the significance of their roles in society and the impact of their\nwork on societal advancement.', 'The program equips students with essential engineering tools to tackte challenges in electronics engineering,\nenabling them to pursue diverse career opportunities. Electives are included to facilitate specialization, enabling\nstudents to develop expertise in particular areas. The program also emphasizes fundamental concepts, updating\nexisting courses to reflect new developments.\n\n1', 'DepartmentofMathematics,CollegeofScienceandEngineering,AteneodeNagaUniversity\nBachelorofScienceinMathematics(BSMath)RevisedCurriculumSY2018–2019(versionofApril3,2018)\nCurriculumRevisionforBachelorofScienceinMathematics(BSMath)\n(basedonCMOn.48s.2017)\nRationale\nThecurriculumoftheBSMathdegreeprogramlasthadamajorrevisionin2008(CMOn.19s.2007).Itwas\nrevisedin2015(MemorandumfromtheChairperson,April23,2015)to""reflecttheshiftortransformationofthe\nexistingundergraduateprogramstolearningcompetencybasedstandards/outcomes-basededucation.""Itisnow\nundergoinganothermajorrevisionfollowingCMOno.48s.2017duetotheadditionoftwoyearstobasiceducation\n(RepublicAct10533,2013),thecreationofanewGeneralEducationCurriculum(CMOn.20s.2013),andthe\nrationalizationofmathematicseducationinthecountry(CommissionenbancResolutionn.231-2017).\nProgramDescription\nTheBachelorofScienceinMathematics(BSMath)degreeprogram“providesstudentswithsubstantialexposure', 'DepartmentofMathematics,CollegeofScienceandEngineering,AteneodeNagaUniversity\nBachelorofScienceinMathematics(BSMath)RevisedCurriculumSY2018–2019(versionofApril3,2018)\nYear3,Semester2\nYear4,Semester1\nYear4,Semester2\nPage3of21', 'DepartmentofNaturalSciences\nCollegeofScienceandEngineering\nAleneodeNagaUniversity\nBachelorofScienceInEnvlronmentalManagement(BSEM)\nRevisedCurrtculum\nSY2018-2019\nSECONDYEAR1•SEMESTER\nCourse\nCode\nNSCS101\nPHIN102\nECOL211\nECOL212\nECHE211\nECHE212\nELAW121\nPEDS103\nNSTP101\nCRCP003\nSECONDYEAR2""""SEMESTER\nTHIRDYEAR1""SEMESTER\n4', 'AteneodeNagaUniversity\nCollegeofScience,EngineeringandArchitecture\nEcE-CpEDepartment\nRevisedCurriculumforBachelorofScienceInComputerEngineering(BSCpE)\n5/Y2025-2026\nBasedonCMO87s2017\nI.RationaleoftheRevision\nTheBachelorofScienceInComputerEngineering(BSCpE)programemphasizescorecompetenciesinthediscipline\nthatareessentialforprofessionalpracticeofCpEgraduates.ThesecompetenciesreflecttechnicalsldllsandIgnatlan\nvaluessuchasproblem-solving,designskills,criticalthinking,andmore.Toensurethatthesecompetenciesareattained,\nitisessentialtostrengthenfoundationalsubjectslikemathematics.Toenhanceopportunitiesforprofessionalpractice,\ntheprofessionalelectivecourses(withinthesametrack)areupdatedandalignedwithindustrydemands,whichalso\nprovidemoreoptionsforseniorprojects.\nTheInclusionofthecourseonBasicEngineeringMathematicsInthecurriculumwlllallowtheadmissionofSTEM\nandnon-STEMSHScompleterstotheprogramtoensureamiculumviability.', 'CIVILENGINEERINGANDARCHITECTUREDEPARTMENT\nCollegeofScience,EnglneeringandArchitecture\nATENEODENAGAUNIVERSITY\nCurriculumRevisionforBachelorofScienceInCivilEnglneering(BSCE)SY2024-2025\nBasedonCMONo.92Serlesof2017\nRATIONALE\nThiscurriculumrevisionoftheBachelorofScienceinCivilEngineering,BSCEprogram,implements\ntheshifttooutcome-basededucation(OBE),therebyaligningtocompetency-basedstandards.This\nrevisionadherestotheregulationssetintheCMO92Seriesof2017andintheOutcomes-BasedEducation\nqualityassurancesystemasadvocatedunderCMO46Series2012andasaddendumtoCMO37Series\n2012establishinganOutcome-BasedEducationalSysteminHigherEducationInstitutionsoffering\nEngineeringPrograms.\nTheintegrationofBasicEngineeringMathematicsrepresentsasignificantenhancementaimedat\nfosteringinclusivityamongbothSTEMandnon-STEMgraduateswithintheprogram.Themajorrevision\nentailsthestrategicadjustmentoftheprofessionalsubjectConstructionMethodandProject\nManagementduringthethirdyear,withtheobjectivetobridgethegapbetweenacademiaand']","The basis for the revised curriculum for Bachelor of Science In Electronics Engineering for S/Y 2024-2025 is CMO No. 101 Serles of 2017, which implements the shift to outcomes-based education (OBE) and competency-based standards.",CMO No. 101 Serles of 2017,,,,,,7.604281902313232
What is the purpose of including electives in the Bachelor of Science in Electronics Engineering program?,"['The program equips students with essential engineering tools to tackte challenges in electronics engineering,\nenabling them to pursue diverse career opportunities. Electives are included to facilitate specialization, enabling\nstudents to develop expertise in particular areas. The program also emphasizes fundamental concepts, updating\nexisting courses to reflect new developments.\n\n1', 'a. Program Title and Description\n\nThe Bachelor of Science in Electronics Engineering (BSECE) program is structured to cultivate engineers with a\nrobust grounding in mathematics, natural sciences, physical sciences, and related disciplines. Accordingly, the\nprogram comprises mathematics, science, and engineering fundamentals courses, focusing on nurturing analytical\nand creative skills. It also encompasses language studies, social sciences, humanities, and other core courses to\nensure that graduates are articulate and comprehend the significance of their roles in society and the impact of their\nwork on societal advancement.', 'Ateneo de Naga University\nCollege of Science, Engineering, and Architecture\nElectronics and Computer Engineering Department\nRevised Curriculum for Bachelor of Science In Electronics Engineering (BSECE) S/Y 2024-2025\nBased on CMO No. 101 Serles of 2017\nI. Rationale ,\n\n20 With the integration of outcomes-based, according to the guidelines for implementing CMO No. 46 series of\n\n12 and CMO 37 s. 2012, this curriculum implements the shift to outcomes-based education (OBE), leading to\nCompetency-based standards. This includes the “core competencies” expected of Bachelor of Science in Electronics\nEngineering (BSECE) graduates with Ignatian Ideals.', 'The BSECE program, with Ignatian ideals, emphasizes core competencies that are essential for ECE\nBraduates. These competencies reflect technical skills and Ignatian values such as problem-solving, design skills,\ncritical thinking, and more. To ensure that these competencies are attained, it is essential to strengthen foundational\nSubjects like mathematics. This will be achieved by integrating Basic Engineering Mathematics into the program.\n\nAdding Basic Engineering Mathematics will allow STEM and non-STEM SHS to Join the program. As an option,\nemerging technology professional electives are included with the demand for new technology. The new professional\nelectives courses will supplement the senior’s projects. In addition to the revision, the course code for Differential\nEquation and Engineering Technopreneurship was changed to align with other engineering programs.\n\na. Program Title and Description', '2. _ Fill-out the form and submit it to OSA for approval.\nF. University Code of Conduct for Users of Electronic Facilities\n1. Objective\nThis Code of Conduct is to facilitate the efficient, effective, responsible and lawful use of the\nUniversity’s electronic facilities, thereby safeguarding the interests of all users and of the University.\n2. Application\nThe Code applies to all users of the University’s electronic facilities including staff, students and\nother authorized users, wherever they may be using the facilities.\nThe Code applies to all of the University’s electronic facilities, irrespective of the college, faculty\nor other unit providing the facilities, and whether the facilities are located on a campus or site of\nthe University or elsewhere.\nElectronics facilities includes:\na. computer hardware (free standing computers, networked computers, time shared\ncomputers, terminals);\nb. peripherals (for example, printers, scanners, mobile telephones when connecting to the', '} aecrase | Engineering Communication 3 Laboratory: Transmission Media and Antenna QECP411, QECP412,\nECP. :\nQECP432 system QECP431 QECPO20\nGEALIO3 | EngneeringManagemers——SSCSCSCSCSCSCSCSSTSCCdT dP 2 ff one\nQECE0Os | Professional EiectneS= CSCS} eh] | CP CeO\nCO OC“‘“‘(‘(C(NSCCMtatNUmnberfms |B eC\n* Non-Credit Subject (Optional): Upan comptetion of ALL Computer Networks Professional Electives, QECE001, QECE002, QECE003, students can opt to apply for cerhfications: Cisco\nCertified Networking Associate (CCNA)\nFROST i ra Semester pemasses St eS ee\n[___ [erhetvessOCCC.CC;C;t‘“C;CSdYYSOSC Cd\n[ S0CS103__| The Contemporary World fr 3 { 3 | o | ‘| socsi2 |\n$0CS104 The Life and Works of Rizal Yr 3 {| 3 | o [| [None |\n| THEN203* | Christian Vocation: Love, Famuity Lite and Soc! P33 |); 3 J] o [| THEN102, PHINLOS\nQECCo20 ECE/CpE Laws, Contracts, Ethics & Standards Poa | 3 fo fT PHIsi02\nQECC230 Engineering Design 2 (Capstone Project 2 2 | o [6 ff Qecezz0', 'Ateneo de Naga University\nCollege of Science, Engineering and Architecture\nEcE-CpE Department\nSECOND YEAR - 2""° SEMESTER\nee Co aE REUIT\npeor frm | | te | “CODE\nCODE\nClee SAA raafaspo] | p>\nass | NTRTORTRT | [a | o | FEL ns | winston\nS0es105 | The Catenpor word P33 [ re [ssa ressg in ie ay\nP| ce teave 2 PspsfPey | |\nprisioz [ethics || 3 | 0 | re: | PeNs02 | Pricsopicl Anthropology\nbaa sme and gn Asis | 2 | 0 | 6 | PRE-| CPP223 | ch tt rogag\nRune Nats ad toss [4 _|_3 [3 | PRE] OBMTIOR | nce ents\nFundamentals of Electrical Circuits Lecture |\nFundamentals of Electronic Circuits Fundamentals of Electrical Grasits\ngeonat | me Peco | igonoy\nFundamentals of Electronic Grats\n| oan | iene eos\nFree | acaatt | rent otra Gos\nQcpazz2 | Fundamental of Bectrone Creuts | | QCPA2I2. | Fundamentals of Electrical Creuits Laboratory\nFundamentals of Electronic Grauits\nfoo | ecm: [imntaoas\nFeensea | eerenty Eaorics |S | Om | GeALTOL | Egret ts\nA\nTHIRD YEAR —~ 1° SEMESTER\nwa [PONT CO Tae ST\nCOURSE', 'ATENEODENAGAUNIVERSITY\nCollegeofScience,EngineeringandArchitecture\nDepartmentofCivilEngineeringandArchitecture\nCURRICULUMFORBACHELOROFSCIENCEINARCHITECTURE(BSARCH)\nSY2022-2023\nBasedonCMONo.61Seriesof2017\nFIRSTYEAR-FirstSemester\n*Non-Credit,requiredtoallgraduatesofNon-CatholicSHS\nFIRSTYEAR-SecondSemester']","The purpose of including electives in the Bachelor of Science in Electronics Engineering program is to facilitate specialization, enabling students to develop expertise in particular areas.","to facilitate specialization, enabling students to develop expertise in particular areas",,,,,,7.7715535163879395
What is the prerequisite course title for ARCH529 Business Management & Application for Architecture,"['FIFTH YEAR - Second Semester\nP hours)\nCourse . Credit a a .\nCode Course Title Units |] Prerequisite | Prerequisite Course Title\nTHEN102 |Christian Moral Paradigm\nTHEN103 |Christian Vocation, Love, Marriage and Family Life 3 3\nPHIN103 |Philosophy of Religion\nProfessional Practice 3\nARCH529 |Business Management & Application for Architecture 2 3 3 ARCH429 |(Global Practice in the\n21st Century)\nARCH523 |Architectural Design 10 - Thesis Research Application 5 | 4 12 | ARCHS13 [AThitectural Design 9 -\nThesis Research Writing\nARCHS  |*Specialization 3 F 3 fat [| ARCHS Specialization 2\n- ao fa Pe fey ey', '| Course\nCode | Course Title | Credit\nUnits | Pay Units (in\nhours) |  |  | Prerequisite | Prerequisite Course Title |\n| --- | --- | --- | --- | --- | --- | --- | --- |\n|  |  |  | lec | lab | stu\ndio |  |  |\n| THEN103 | Christian Vocation, Love, Marriage and Family Life | 3 | 3 |  |  | THEN102 | Christian Moral Paradigm |\n|  |  |  |  |  |  | PHIN103 | Philosophy of Religion |\n| ARCH529 | Business Management & Application for Architecture 2 | 3 | 3 |  |  | ARCH429 | Professional Practice 3\n(Global Practice in the\n21st Century) |\n| ARCH523 | Architectural Design 10 - Thesis Research Application | 5 | 1 |  | 12 | ARCH513 | Architectural Design 9 -\nThesis Research Writing |\n| ARCHS | *Specialization 3 | 3 | 3 |  |  | ARCHS | Specialization 2 |\n|  | Total no. of units | 14 | 10 | 0 | 12 |  |  |\n', '| Course\nCode | Course Title | Credit\nUnits | Pay Units (in\nhours) |  |  | Prerequisite | Prerequisite Course Title |\n| --- | --- | --- | --- | --- | --- | --- | --- |\n|  |  |  | lec | lab | stu\ndio |  |  |\n|  | GE Elective 3 | 3 | 3 |  |  |  |  |\n| ARCH518 | Architectural Structures | 3 | 3 |  |  | ARCH328 | Steel and Timber Design |\n| ARCH510 | Housing | 2 | 2 |  |  | ARCH417 | Planning 2 -\nFundamentals of urban\ndesign & Community\nArchitecture |\n|  |  |  |  |  |  | ARCH329 | Professional Practice 1\n(Laws affecting the\nPractice of Architecure) |\n| ARCH519 | Business Management & Application for Architecture 1 | 3 | 3 |  |  | ARCH429 | Professional Practice 3\n(Global Practice in the\n21st Century) |\n| ARCH513 | Architectural Design 9 - Thesis Research Writing | 5 | 1 |  | 12 |  | All courses in 1st year -\n4th year level |\n| ARCHS | *Specialization 2 | 3 | 3 |  |  | ARCHS | Specialization 1 |\n|  | Total no. of units | 19 | 15 | 0 | 12 |  |  |\n', '| Course\nCode | Course Title | Credit\nUnits | Pay Units (in\nhours) |  |  | Prerequisite | Prerequisite Course Title |\n| --- | --- | --- | --- | --- | --- | --- | --- |\n|  |  |  | lec | lab | stu\ndio |  |  |\n| ARCH328 | Steel and Timber Design | 3 | 3 |  |  | ARCH318 | Theory of Structures |\n| ARCH327 | Planning 1 - Site Planning and Landscape Architecture | 3 | 3 |  |  | ARCH217 | Surveying |\n|  |  |  |  |  |  | ARCH229 | Tropical Design |\n| ARCH325 | Computer-Aided Design & Drafting for Architecture 2 | 2 | 1 | 3 |  | ARCH315 | Computer-Aided Design &\nDrafting for Architecture 1 |\n| ARCH329 | Professional Practice 1 (Laws affecting the Practice of\nArchitecture) | 3 | 3 |  |  | PHIS102 | Ethics |\n| ARCH320 | Special Design - Collaborative work with CE students | 1 |  |  | 3 | ARCH313 | Architectural Design 5 -\nSpace Planning 2 |\n| ARCH323 | Architectural design 6- Site Development Planning and\nLandscaping | 4 | 1 |  | 9 | ARCH313 | Architectural Design 5 -\nSpace Planning 2 |\n| ARCH326 | Building Technology 4 - Specification Writing and\nQuantity Surveying | 3 | 2 |  | 3 | ARCH316 | Building technology 3 -\nConstruction Drawings in\nwood, Steel and Concrete\n(2 Storey res. Structure) |\n| ARCH322 | Building Utilities 3 (BU 3) - Acoustic and Lighting\nSystems | 3 | 2 |  | 3 | ARCH312 | Building Utilities 2 (BU 2) -\nelectrical, Electronics and\nMechanical Systems |\n|  | Total no. of units | 22 | 15 | 3 | 18 |  |  |\n', 'SECOND YEAR - First Semester\nP hours)\nCourse . Credit a woe .\nCode Course Title Units || Prerequisite | Prerequisite Course Title\n; . Logical and Critical\nPHIN102 |Philosophical Anthropology pa fa} | PHIN101 Thinking\nARCH218 | Statics of Rigid Bodies 3 | 3 GEmT103 |Dlerential & Integral\nCalculus\n. . og ; Architectural Visual\nARCH215 Architectural Visual Communications 5 - Visual , 1 3 | ARCH125 |Communications 4 -\nTechniques 3 ; .\nVisual Techniques 2\nARCH211 |History of Architecture 2 p2 fat | | ARCH111 |History of Architecture 1\nArchitectural Design 2 -\nARCH123 |Creative Design and\ni ian 3 - i ign i i Fundamentals\nARCH213 ecu Design 3 - Creative Design in Architectural 3 1\nMenors ARCH122 |Theory of Architecture 2\nARCH121 [Architectural Interiors\nARCH216 Building Utilities 1 (BU 4) - Plumbing and Sanitary 3 9 3 NONE\nSystems\nPEDS103 |individual/Dual Games and Sports p2 fat | | PEDS101 |Physical Fitness 1', '| Course\nCode | Course Title | Credit\nUnits | Pay Units (in\nhours) |  |  | Prerequisite | Prerequisite Course Title |\n| --- | --- | --- | --- | --- | --- | --- | --- |\n|  |  |  | lec | lab | stu\ndio |  |  |\n| THEN102 | Christian Moral Paradigm | 3 | 3 |  |  | THEN101 | Christian Discipleship\nToday |\n|  | GE Elective 1 | 3 | 3 |  |  |  |  |\n| ARCH417 | Planning 2 - Fundamentals of urban design &\nCommunity Architecture | 3 | 3 |  |  | ARCH327 | Planning 1 - Site Planning\nand Landscape\nArchitecture |\n| ARCH410 | Building Information Modelling | 1 |  | 3 |  | ARCH325 | Computer-Aided Design &\nDrafting for Architecture 2 |\n| ARCH419 | Professional Practice 2 (Administering the Regular\nServices of an Architect) | 3 | 3 |  |  | ARCH329 | Professional Practice 1\n(Laws affecting the\nPractice of Architecture) |\n| ARCH413 | Architectural Design 7 - Community Architecture and\nUrban design | 5 | 1 |  | 12 | ARCH323 | Architectural Design 6-\nSite Development\nPlanning and\nLandscaping |\n| ARCH416 | Building Technology 5 - Alternative Building Construction\nSystems | 3 | 2 |  | 3 | ARCH316 | Building technology 3 -\nConstruction Drawings in\nwood, Steel and Concrete\n(2 Storey res. Structure) |\n|  | Total no. of units | 21 | 15 | 3 | 15 |  |  |\n', '| Course\nCode | Course Title | Credit\nUnits | Pay Units (in\nhours) |  |  | Prerequisite | Prerequisite Course Title |\n| --- | --- | --- | --- | --- | --- | --- | --- |\n|  |  |  | lec | lab | stu\ndio |  |  |\n| PHIS102 | Ethics | 3 | 3 |  |  | PHIS101 | Understanding the Self |\n| SOCS101 | Art Appreciation | 3 | 3 |  |  | NONE |  |\n| ARCH228 | Strength of Materials | 3 | 3 |  |  | ARCH218 | Statics of Rigid Bodies |\n| ARCH229 | Tropical Design | 2 | 2 |  |  | NONE |  |\n| ARCH221 | History of Architecture 3 | 2 | 2 |  |  | ARCH211 | History of Architecture 2 |\n| ARCH223 | Architectural Design 4 - Space planning 1 | 3 | 1 |  | 6 | ARCH213 | Architectural Design 3 -\nCreative Design in\nArchitectural Interiors |\n| ARCH226 | Building Technology 2 - Construction Drawings in Wood,\nSteel and Concrete (1- Storey) | 3 | 2 |  | 3 | ARCH126 | Building Technology 1 -\nBuilding Materials |\n|  |  |  |  |  |  | ARCH216 | Building Utilities 1 - Plumbing\nand Sanitary Systems |\n| PEDS104 | Team Sports and Adaptive Activities | 2 | 2 |  |  | PEDS101 | Physical Fitness 1 |\n', '| Course\nCode | Course Title | Credit\nUnits | Pay Units (in\nhours) |  |  | Prerequisite | Prerequisite Course Title |\n| --- | --- | --- | --- | --- | --- | --- | --- |\n|  |  |  | lec | lab | stu\ndio |  |  |\n| NSCS101 | Science, Technology & Society | 3 | 3 |  |  | NONE |  |\n| SOCS103 | Contemporary world | 3 | 3 |  |  | SOCS102 | Readings in Philippine\nHistory |\n| ARCH318 | Theory of Structures | 3 | 3 |  |  | ARCH228 | Strength of Materials |\n| ARCH315 | Computer-Aided Design & Drafting for Architecture 1 | 2 | 1 | 3 |  | ARCH215 | Architectural Visual\nCommunications 5 -\nVisual Techniques 3 |\n| ARCH311 | History of Architecture 4 | 2 | 2 |  |  | ARCH221 | History of Architecture 3 |\n| ARCH313 | Architectural Design 5 - Space Planning 2 | 4 | 1 |  | 9 | ARCH223 | Architectural Design 4 -\nSpace planning 1 |\n| ARCH316 | Building technology 3 - Construction Drawings in wood,\nSteel and Concrete (2 Storey res. Structure) | 3 | 2 |  | 3 | ARCH226 | Building Technology 2 -\nConstruction Drawings in\nWood, Steel and\nConcrete (1- Storey) |\n|  |  |  |  |  |  | ARCH216 | Building Utilities 1 -\nPlumbing and Sanitary\nSystems |\n| ARCH312 | Building Utilities 2 (BU 2) - electrical, Electronics and\nMechanical Systems | 3 | 2 |  | 3 | ARCH216 | Building Utilities 1 -\nPlumbing and Sanitary\nSystems |\n|  | Total no. of units | 23 | 17 | 3 | 15 |  |  |\n']","The prerequisite course title for ARCH529 Business Management & Application for Architecture is ARCH429, which is Professional Practice 3 (Global Practice in the 21st Century).",Global Practice in the 21st Century,,,,,,7.155084609985352
What is the prerequisite course for ARCH228 Strength of Materials?,"['Systems\nPEDS103 |individual/Dual Games and Sports p2 fat | | PEDS101 |Physical Fitness 1\nNSTP101 |National Service Training Program 1 (CWTS) pa fa) |. CIFP102 ADNU Social Mission and\nFormation\nCRCP003 |SRA Reading Program 3 (1.5] 5} | | CRCP002 |SRA Reading Program 2\n- ao fa Ps fefey\nSECOND YEAR - Second Semester\nP hours)\nCourse . Credit a woe .\nCode Course Title Units |e] Prerequisite | Prerequisite Course Title\nARCH228 |Strength of Materials Ps fat | | ARCH218 |Statics of Rigid Bodies\nARCH221 |History of Architecture 3 p2 fat | | ARCH211 |History of Architecture 2\nArchitectural Design 3 -\nARCH223 |Architectural Design 4 - Space planning 1 3 1 ARCH213 |Creative Design in\nArchitectural Interiors\n. _ ARCH126 Building Technology 1 -\nBuilding Technology 2 - Construction Drawings in Wood, Building Materials\nARCH226 3 2 3\nSteel and Concrete (1- Storey) ARCH216 |Buiing Utites 1 - Plumbing\nand Sanitary Systems', '| Course\nCode | Course Title | Credit\nUnits | Pay Units (in\nhours) |  |  | Prerequisite | Prerequisite Course Title |\n| --- | --- | --- | --- | --- | --- | --- | --- |\n|  |  |  | lec | lab | stu\ndio |  |  |\n| NSCS101 | Science, Technology & Society | 3 | 3 |  |  | NONE |  |\n| SOCS103 | Contemporary world | 3 | 3 |  |  | SOCS102 | Readings in Philippine\nHistory |\n| ARCH318 | Theory of Structures | 3 | 3 |  |  | ARCH228 | Strength of Materials |\n| ARCH315 | Computer-Aided Design & Drafting for Architecture 1 | 2 | 1 | 3 |  | ARCH215 | Architectural Visual\nCommunications 5 -\nVisual Techniques 3 |\n| ARCH311 | History of Architecture 4 | 2 | 2 |  |  | ARCH221 | History of Architecture 3 |\n| ARCH313 | Architectural Design 5 - Space Planning 2 | 4 | 1 |  | 9 | ARCH223 | Architectural Design 4 -\nSpace planning 1 |\n| ARCH316 | Building technology 3 - Construction Drawings in wood,\nSteel and Concrete (2 Storey res. Structure) | 3 | 2 |  | 3 | ARCH226 | Building Technology 2 -\nConstruction Drawings in\nWood, Steel and\nConcrete (1- Storey) |\n|  |  |  |  |  |  | ARCH216 | Building Utilities 1 -\nPlumbing and Sanitary\nSystems |\n| ARCH312 | Building Utilities 2 (BU 2) - electrical, Electronics and\nMechanical Systems | 3 | 2 |  | 3 | ARCH216 | Building Utilities 1 -\nPlumbing and Sanitary\nSystems |\n|  | Total no. of units | 23 | 17 | 3 | 15 |  |  |\n', '| Course\nCode | Course Title | Credit\nUnits | Pay Units (in\nhours) |  |  | Prerequisite | Prerequisite Course Title |\n| --- | --- | --- | --- | --- | --- | --- | --- |\n|  |  |  | lec | lab | stu\ndio |  |  |\n| ARCH328 | Steel and Timber Design | 3 | 3 |  |  | ARCH318 | Theory of Structures |\n| ARCH327 | Planning 1 - Site Planning and Landscape Architecture | 3 | 3 |  |  | ARCH217 | Surveying |\n|  |  |  |  |  |  | ARCH229 | Tropical Design |\n| ARCH325 | Computer-Aided Design & Drafting for Architecture 2 | 2 | 1 | 3 |  | ARCH315 | Computer-Aided Design &\nDrafting for Architecture 1 |\n| ARCH329 | Professional Practice 1 (Laws affecting the Practice of\nArchitecture) | 3 | 3 |  |  | PHIS102 | Ethics |\n| ARCH320 | Special Design - Collaborative work with CE students | 1 |  |  | 3 | ARCH313 | Architectural Design 5 -\nSpace Planning 2 |\n| ARCH323 | Architectural design 6- Site Development Planning and\nLandscaping | 4 | 1 |  | 9 | ARCH313 | Architectural Design 5 -\nSpace Planning 2 |\n| ARCH326 | Building Technology 4 - Specification Writing and\nQuantity Surveying | 3 | 2 |  | 3 | ARCH316 | Building technology 3 -\nConstruction Drawings in\nwood, Steel and Concrete\n(2 Storey res. Structure) |\n| ARCH322 | Building Utilities 3 (BU 3) - Acoustic and Lighting\nSystems | 3 | 2 |  | 3 | ARCH312 | Building Utilities 2 (BU 2) -\nelectrical, Electronics and\nMechanical Systems |\n|  | Total no. of units | 22 | 15 | 3 | 18 |  |  |\n', '. . . National Service Training\nNSTP102 |National Service Training Program 2 (CWTS) pa fa) | NSTP101 Program 1 (CWTS)\nCRCP004 |SRA Reading Program 4 [1.5] as} | | CRCP003 |SRA Reading Program 3\na fa a\nTHIRD YEAR - Intersession\nP hours)\nCourse . Credit a a .\nCode Course Title Units ec] |S Prerequisite | Prerequisite Course Title\nEso ovonecommnam «| | | PEP\n; . Philosophical!\nPHIN103 |Philosophy of Religion pa fa) | PHIN102 Anthropology\n$0CS102 |Readings in Philippine History F 3 fat [| NONE po\nao fa ee\nTHIRD YEAR - First Semester\nP hours)\nCourse . Credit a a .\nCode Course Title Units |e] Prerequisite | Prerequisite Course Title\nNSCS101 |Science, Technology & Society F 3 fat [| NONE po\nS$OCS103 |Contemporary world pa fal | | SOCS102 Readings in Philippine\nHistory\nARCH318 | Theory of Structures F 3 fat [| ARCH228 |Strength of Materials\nArchitectural Visual\nARCH315 |Computer-Aided Design & Drafting for Architecture 1 2 1] 3 ARCH215 |Communications 5 -\nVisual Techniques 3', '| Course\nCode | Course Title | Credit\nUnits | Pay Units (in\nhours) |  |  | Prerequisite | Prerequisite Course Title |\n| --- | --- | --- | --- | --- | --- | --- | --- |\n|  |  |  | lec | lab | stu\ndio |  |  |\n|  | GE Elective 3 | 3 | 3 |  |  |  |  |\n| ARCH518 | Architectural Structures | 3 | 3 |  |  | ARCH328 | Steel and Timber Design |\n| ARCH510 | Housing | 2 | 2 |  |  | ARCH417 | Planning 2 -\nFundamentals of urban\ndesign & Community\nArchitecture |\n|  |  |  |  |  |  | ARCH329 | Professional Practice 1\n(Laws affecting the\nPractice of Architecure) |\n| ARCH519 | Business Management & Application for Architecture 1 | 3 | 3 |  |  | ARCH429 | Professional Practice 3\n(Global Practice in the\n21st Century) |\n| ARCH513 | Architectural Design 9 - Thesis Research Writing | 5 | 1 |  | 12 |  | All courses in 1st year -\n4th year level |\n| ARCHS | *Specialization 2 | 3 | 3 |  |  | ARCHS | Specialization 1 |\n|  | Total no. of units | 19 | 15 | 0 | 12 |  |  |\n', 'SECOND YEAR - First Semester\nP hours)\nCourse . Credit a woe .\nCode Course Title Units || Prerequisite | Prerequisite Course Title\n; . Logical and Critical\nPHIN102 |Philosophical Anthropology pa fa} | PHIN101 Thinking\nARCH218 | Statics of Rigid Bodies 3 | 3 GEmT103 |Dlerential & Integral\nCalculus\n. . og ; Architectural Visual\nARCH215 Architectural Visual Communications 5 - Visual , 1 3 | ARCH125 |Communications 4 -\nTechniques 3 ; .\nVisual Techniques 2\nARCH211 |History of Architecture 2 p2 fat | | ARCH111 |History of Architecture 1\nArchitectural Design 2 -\nARCH123 |Creative Design and\ni ian 3 - i ign i i Fundamentals\nARCH213 ecu Design 3 - Creative Design in Architectural 3 1\nMenors ARCH122 |Theory of Architecture 2\nARCH121 [Architectural Interiors\nARCH216 Building Utilities 1 (BU 4) - Plumbing and Sanitary 3 9 3 NONE\nSystems\nPEDS103 |individual/Dual Games and Sports p2 fat | | PEDS101 |Physical Fitness 1', '| Course\nCode | Course Title | Credit\nUnits | Pay Units (in\nhours) |  |  | Prerequisite | Prerequisite Course Title |\n| --- | --- | --- | --- | --- | --- | --- | --- |\n|  |  |  | lec | lab | stu\ndio |  |  |\n| PHIN102 | Philosophical Anthropology | 3 | 3 |  |  | PHIN101 | Logical and Critical\nThinking |\n| ARCH218 | Statics of Rigid Bodies | 3 | 3 |  |  | GEMT103 | Differential & Integral\nCalculus |\n| ARCH217 | Surveying | 4 | 3 | 3 |  | MATH111 | Solid Mensuration |\n| ARCH215 | Architectural Visual Communications 5 - Visual\nTechniques 3 | 2 | 1 |  | 3 | ARCH125 | Architectural Visual\nCommunications 4 -\nVisual Techniques 2 |\n| ARCH211 | History of Architecture 2 | 2 | 2 |  |  | ARCH111 | History of Architecture 1 |\n| ARCH213 | Architectural Design 3 - Creative Design in Architectural\nInteriors | 3 | 1 |  | 6 | ARCH123 | Architectural Design 2 -\nCreative Design and\nFundamentals |\n|  |  |  |  |  |  | ARCH122 | Theory of Architecture 2 |\n|  |  |  |  |  |  | ARCH121 | Architectural Interiors |\n| ARCH216 | Building Utilities 1 (BU 1) - Plumbing and Sanitary\nSystems | 3 | 2 |  | 3 | NONE |  |\n| PEDS103 | Individual/Dual Games and Sports | 2 | 2 |  |  | PEDS101 | Physical Fitness 1 |\n| NSTP101 | National Service Training Program 1 (CWTS) | 3 | 3 |  |  | CIFP102 | ADNU Social Mission and\nFormation |\n| CRCP003 | SRA Reading Program 3 | [1.5] | 1.5 |  |  | CRCP002 | SRA Reading Program 2 |\n|  | Total no. of units | 25 | 21.5 | 3 | 12 |  |  |\n', 'ARCH226 3 2 3\nSteel and Concrete (1- Storey) ARCH216 |Buiing Utites 1 - Plumbing\nand Sanitary Systems\nPEDS104 |Team Sports and Adaptive Activities P 2 fat | | PEDS101 |Physical Fitness 1']",The prerequisite course for ARCH228 Strength of Materials is ARCH218 Statics of Rigid Bodies.,ARCH218 Statics of Rigid Bodies,,,,,,4.998476982116699
What grade description corresponds to a CFRS of 90-93?,"['1. The Grading Scale\nUnder the revised college grading system, letter grades are assigned according an eight (8) level scale\nwith the indicated point values and descriptions, namely:\n2018 Revised Grading System\nGrade & Grade Description\nCFRS\n96-100 | 98-100 Excellent academic performance\n90-95 94-97 Superior academic performance\n84 - 89 90-93 | BR | Very good academic performance\n78 - 83 86 - 89 Good academic performance\n71-77 82 - 85 Moderately good academic performance\n65 - 70 78 - 81 Fair academic performance\n60 - 64 75-77 fo oD Passing academic performance\nBelow 75 Unacceptable academic performance | 0.0 |\n16\n| Student Handbook 2025-2026__INSIDE.indd 180 8/20/25 1:43PM |', 'INC means that the student has not fulfilled the course requirements, e.g., term paper, research; project,\netc., within the semester. It is a temporary grade which obliges the student to complete the require-\nment within the period specified for this purpose. For INC grades, the teacher is obliged to fill up the\nRemarks column of the mark sheet with NFE (no final exam) or NCR (no course requirement).\n\nThe letter grades correspond to numerical grades, which are based on the course’s learning objectives\nand are measured in terms of the Converted Final Raw Score (CFRS) arranged as follows:\nTRANSMUTATION TABLE FOR THE 2018 REVISED GRADING SYSTEM\nConverted Final Raw Score Numerical Letter\nOPI/Point Val\n(CFRS)\n98-99 | 9 A 4.00\n96-97 pe\n93-94 |\nB+ 3.50\n90-91\n88 - 89\n25-86 3.00\nee ee\n82-83 |e\n80-81\nC+ 2.50\na ee ee\n17\n| Student Handbook 2025-2026__INSIDE.indd 181 8/20/25 1:43PM |', 'The Preliminary Exam with a score of 83 has a converted raw score (CRS) percentage of 75.45, and\nmultiplying this by the assigned weight of 0.10 gives us a CFRS of 7.54. Midterm Exams score of 172 has a\nCRS percentage of 90.52, which when multiplied by its assigned weight of 0.20 gives us a CFRS percentage\nof 18.10. Pre-final Exam score of 78 has CRS percentage of 82.10, and when multiplied by the assigned\nweight of .10 gives CFRS of 8.21. Finally, the Final Exam score of 192 has a CRS percentage of 76.8, and\nwhen multiplied by the assigned weight of .20 gives a CFRS OF 15.36. Adding all the CFRS for the grading\ncomponents CS, PLE, ME, PFE, and FE, we have a CFRS of 82.35 or 82.\n\nFrom the transmutation tables, a CFRS of 82 transmutes to a numerical grade of 89 which in turn is\nequivalent to a letter grade of B under the 2005 GS or C+ under the 2018 RGS.\n\n3. Computation of Average Quality Point Index', 'a total weighted CRS for class standing (82.85). This is then multiplies by .40 since CS accounts for 40% of\nthe total Converted Final Raw Score (CFRS). This gives us a CFRS of 33.14 for CS.', 'Academic Regulations = s\n74-75\n72-73 C+ 2.50\n69-70\n66-67\nC 2.00\n63-64\n61-62\n— ® |» | pd [| 100 |\n50=89\n40 - 49\n30-39 F\n20-29\nBelow 20\n2. Mode of Computation of the Final Grade. The mode of computing the Converted Final Raw Score\nthat is later transmuted to a numerical grade is the same for both the 2005 GS and 2018 RGS. They\ndiffer only in the transmutation to the letter grade.\na. Lecture Course or Non-Laboratory Course\n; Percentage of Converted Final Raw Score (CFRS)\nGrading Components\nClass Standing 33.33%\n| Preliminary Examination | tom |\n33.33%\nPre-Final Examination +\nComprehensive Final Examination 33.33%\n100% 100%', '“: { Irn > CHAPTER 4\n\n| xxx_| xxx | 2600 [| 400 | 500 | 400 [| [| | F Fen |\nThe student in the example has a sub-total or partial CFRS of 39 and needs to get\nat least 21 points more from the final exam to obtain a passing CFRS of at least 60.\nHowever, a perfect score in the final exam will only contribute 20 points. In this case,\nthe final exam will have no bearing, that is, the student has no more chance of passing\nthe course. Hence, the teacher already reflected an ”F” grade and indicated “FENB”\nin the column for remarks.\nHowever, because the taking of examinations has instructional value regardless\nof the outcome, any concerned student who may decide to still take the final\nexamination must be allowed to do so, provided his/her application to take\ndelayed examination(s) is duly processed and approved.', 'Academic Regulations = s\nOt\nft\na <s\na A\n[ree 9000\n4, Pre-final Exam\n\nThe computations of the percentage scores for the components are summarized in the next table.\nGrading Component\nCorrect Raw Score (CRS) Weighted CRS P|\nercentage\nClass Standing 33.14\n(148/200) x 100=74.0 74.0 x 0.40=29.6\n(92/100) x 100=92.0 92.0 x 0.15=13.8\n(90/100) x 100=90.0 90.0 x 0.10=9.0\n(87/100) x 100=87 87 x 0.35=30.45\nTotal for Class Standing 82.85\nPreliminary Exam (83/110) x 100=75.45 75.45x0.10=7.54\n(172/190)x 100=90.52 90.52x0.20=18.10 18.10\nPre-Final Exam (78/95) x 100=82.10 82.10x0.10=8.21\n(192/250) x 100=76.8 76.8x0.20=15.36 15.36\nTOTAL (Converted Final Raw Score) 82.35=82\n21\n| Student Handbook 2025-2026__INSIDE.indd 185 8/20/25 1:43PM |', '“: { re > CHAPTER 4\n\n¢ — Tests and Quizzes\n\n¢ — Reports or projects\n\n¢ — Student Portfolios\n\n¢ — Class participation\n\n¢ — Oral Presentations\n\n¢ Others (e.g., performance assessment which shall be set by department/cluster or teachers\n\nteaching the course, etc.)\nThe Preliminary, Midterm, Pre-final and the Comprehensive Final Examinations are usually teach-\ner-made summative evaluations, which may be written, oral, practical, etc.\nb. Practicum, Laboratory or Combined Courses\nPercentage of Converted Final Raw Score (CFRS)\nGrading Components\nRegular Semester\nClass Standing 33.33%\n33.33%\n33.33%\n100% 100%']","The grade description that corresponds to a CFRS of 90-93 is ""Very good academic performance"" with a letter grade of BR.",Very good academic performance,,,,,,6.233504295349121
What percentage of the grading components is based on the Comprehensive Final Examination in a Lecture Course or Non-Laboratory Course?,"['Academic Regulations = s\n74-75\n72-73 C+ 2.50\n69-70\n66-67\nC 2.00\n63-64\n61-62\n— ® |» | pd [| 100 |\n50=89\n40 - 49\n30-39 F\n20-29\nBelow 20\n2. Mode of Computation of the Final Grade. The mode of computing the Converted Final Raw Score\nthat is later transmuted to a numerical grade is the same for both the 2005 GS and 2018 RGS. They\ndiffer only in the transmutation to the letter grade.\na. Lecture Course or Non-Laboratory Course\n; Percentage of Converted Final Raw Score (CFRS)\nGrading Components\nClass Standing 33.33%\n| Preliminary Examination | tom |\n33.33%\nPre-Final Examination +\nComprehensive Final Examination 33.33%\n100% 100%', '“: { re > CHAPTER 4\n\n¢ — Tests and Quizzes\n\n¢ — Reports or projects\n\n¢ — Student Portfolios\n\n¢ — Class participation\n\n¢ — Oral Presentations\n\n¢ Others (e.g., performance assessment which shall be set by department/cluster or teachers\n\nteaching the course, etc.)\nThe Preliminary, Midterm, Pre-final and the Comprehensive Final Examinations are usually teach-\ner-made summative evaluations, which may be written, oral, practical, etc.\nb. Practicum, Laboratory or Combined Courses\nPercentage of Converted Final Raw Score (CFRS)\nGrading Components\nRegular Semester\nClass Standing 33.33%\n33.33%\n33.33%\n100% 100%', 'Similarly in these courses, the criteria and standards for evaluating these components of class standing\nshall be determined before the start of the semester by the teachers/cluster/department teaching/offering\nthe course. The same must be reflected in the course syllabus and communicated to the students at the start\nof the semester. Class standing may include/cover the practicum, laboratory or combination.\n\nAn example illustrating the process of computing the final grade using the new grading system.\n\nSuppose that Teacher X who is handling the subject W has decided to have the following elements\nunder Class Standing (CS) with the indicated weights:\n\nTests and Quizzes 40% of CS\nTerm Paper 15% of CS\nProject 10% of CS\nRecitation 35% of CS\nSuppose further that Student A is enrolled in the subject above and has obtained the following scores\nin the indicated components:\nGrading Components\n1. Class Standing\n20\n| Student Handbook 2025-2026__INSIDE.indd 184 8/20/25 1:43PM |', 'Academic Regulations = s\nOt\nft\na <s\na A\n[ree 9000\n4, Pre-final Exam\n\nThe computations of the percentage scores for the components are summarized in the next table.\nGrading Component\nCorrect Raw Score (CRS) Weighted CRS P|\nercentage\nClass Standing 33.14\n(148/200) x 100=74.0 74.0 x 0.40=29.6\n(92/100) x 100=92.0 92.0 x 0.15=13.8\n(90/100) x 100=90.0 90.0 x 0.10=9.0\n(87/100) x 100=87 87 x 0.35=30.45\nTotal for Class Standing 82.85\nPreliminary Exam (83/110) x 100=75.45 75.45x0.10=7.54\n(172/190)x 100=90.52 90.52x0.20=18.10 18.10\nPre-Final Exam (78/95) x 100=82.10 82.10x0.10=8.21\n(192/250) x 100=76.8 76.8x0.20=15.36 15.36\nTOTAL (Converted Final Raw Score) 82.35=82\n21\n| Student Handbook 2025-2026__INSIDE.indd 185 8/20/25 1:43PM |', 'The Preliminary Exam with a score of 83 has a converted raw score (CRS) percentage of 75.45, and\nmultiplying this by the assigned weight of 0.10 gives us a CFRS of 7.54. Midterm Exams score of 172 has a\nCRS percentage of 90.52, which when multiplied by its assigned weight of 0.20 gives us a CFRS percentage\nof 18.10. Pre-final Exam score of 78 has CRS percentage of 82.10, and when multiplied by the assigned\nweight of .10 gives CFRS of 8.21. Finally, the Final Exam score of 192 has a CRS percentage of 76.8, and\nwhen multiplied by the assigned weight of .20 gives a CFRS OF 15.36. Adding all the CFRS for the grading\ncomponents CS, PLE, ME, PFE, and FE, we have a CFRS of 82.35 or 82.\n\nFrom the transmutation tables, a CFRS of 82 transmutes to a numerical grade of 89 which in turn is\nequivalent to a letter grade of B under the 2005 GS or C+ under the 2018 RGS.\n\n3. Computation of Average Quality Point Index', 'Academic Regulations %% _\n= Bs\nB. Term Examinations\nThe Preliminary, Midterm, Pre-final, and Final Examinations are periodic assessments of student\nlearning during the semester. They are conducted orally, in writing, or both, and in announced venues on\nthe schedule calendared by the Academic Council and the Registrar. Not one of them may be foregone\nin favor of a prior or future examination, nor may be substituted with the activities that do not actually\nassess student learning of the lesson coverage for the term, such as tours, seminars, parties and the like.\nThe coverage of the Final Examination particularly is 30% of the first term and 70% of the second term.\nEach student is required to present his/her Examination Slip for each of these examinations.\nC. Delayed Term Examination\n1. On tthe Period for Filing Applications for and Taking the Delayed Examination\n1.1 Delayed preliminary, midterm and pre-final examinations must be completed no later', 'a total weighted CRS for class standing (82.85). This is then multiplies by .40 since CS accounts for 40% of\nthe total Converted Final Raw Score (CFRS). This gives us a CFRS of 33.14 for CS.', 'Academic Regulations %% _\n= i}\n6. Read the questions carefully.\n7. Write neatly.\n8. Answer questions from the easiest to the most difficult.\n9. Review your answers before submitting the examination paper.\nE. Exemption from Final Examinations\nStudents who consistently excel in class as evidenced by the results in the previous assessment\nand evaluation of class performance during the term deserve to be recognized and rewarded at the end\nof the term by exempting them from the final examinations. This exemption shall apply to all subjects\nexcept those covered by the licensure/board examinations, such as accountancy, engineering, and\nmajor and proficiency subjects in education, and the following specific subjects: theology, philosophy,\ncomputer science, taxation, business law, and major subjects in mathematics and natural sciences.\nF. Incomplete Grades\nAstudentis allowed one semester to complete his/her grade. Requirements must be submitted one']","In a Lecture Course or Non-Laboratory Course, the grading components are divided as follows:
| Grading Components | Percentage of Converted Final Raw Score (CFRS) |
| --- | --- |
| Class Standing | 33.33% |
| Preliminary Examination | 33.33% |
| Pre-Final Examination + Comprehensive Final Examination | 33.33% |

Since the Pre-Final Examination and Comprehensive Final Examination together account for 33.33% of the grading components, and there is no separate percentage given for the Comprehensive Final Examination, we can assume that the Comprehensive Final Examination is a part of the 33.33% allocated to the Pre-Final Examination + Comprehensive Final Examination. However, the exact percentage allocated to the Comprehensive Final Examination is not specified.",33.33%,,,,,,7.395975589752197
What is the Average Quality Point Index for the given example?,"[""3. Computation of Average Quality Point Index\n\nThe Average Quality Point Index (QP!) is used as a measure of student's academic performance. To\ndetermine the average OPI, the letter grades are given point values as shown in the Transmutation Table for\nthe 2018 Revised Grading System. It is computed as the quotient of the Accumulated Grade (AG) and the\nTotal Units (TU). An example showing the procedure is shown below:\n\n; . Letter | Point Value .\nCSDC100 — Introduction to Computing | 3 | B | 30 | 900 |\nCSDC101 — Fundamentals of Programming | 3 | B | 30 | 900 |\n\\THS101 = Mathematics in the Modern World\nAverage OP! = AG/TU = 62.50/20 = 3.125\n22\n| Student Handbook 2025-2026__INSIDE.indd 186 8/20/25 1:43PM |"", 'The Preliminary Exam with a score of 83 has a converted raw score (CRS) percentage of 75.45, and\nmultiplying this by the assigned weight of 0.10 gives us a CFRS of 7.54. Midterm Exams score of 172 has a\nCRS percentage of 90.52, which when multiplied by its assigned weight of 0.20 gives us a CFRS percentage\nof 18.10. Pre-final Exam score of 78 has CRS percentage of 82.10, and when multiplied by the assigned\nweight of .10 gives CFRS of 8.21. Finally, the Final Exam score of 192 has a CRS percentage of 76.8, and\nwhen multiplied by the assigned weight of .20 gives a CFRS OF 15.36. Adding all the CFRS for the grading\ncomponents CS, PLE, ME, PFE, and FE, we have a CFRS of 82.35 or 82.\n\nFrom the transmutation tables, a CFRS of 82 transmutes to a numerical grade of 89 which in turn is\nequivalent to a letter grade of B under the 2005 GS or C+ under the 2018 RGS.\n\n3. Computation of Average Quality Point Index', 'No medals or certificates would be awarded to students, but their names will be listed\n\nunder the heading of “Honorable Mention” awardees in the graduation program, and a\n\nremark of “Honorable Mention” shall be appropriately indicated in their official transcript\n\nof records.\nb. Academic Excellence Awards. In order to qualify for an academic excellence award,\nthe student must have at least qualified for Cum Laude.\n\n1. PILLARS GOLD MEDALLION is awarded to the graduate who obtains the highest\nquality point average among the members of the graduating class.\n\n2. PILLARS SILVER MEDALLION is awarded to the graduate who obtains the second\nhighest quality point average among the members of the graduating class.\n\n3. PILLARS BRONZE MEDALLION is awarded to the graduate who obtains the third\nhighest quality point average among the members of the graduating class.\n\nc. General Excellence Awards', 'a total weighted CRS for class standing (82.85). This is then multiplies by .40 since CS accounts for 40% of\nthe total Converted Final Raw Score (CFRS). This gives us a CFRS of 33.14 for CS.', ""Note that the part on computation for each component/element in boldface is the conversion of the\nraw score as a correct raw score (CRS) percentage while the rest of the computation is the conversion of such\nCRS into a weighted CRS for the component. For instance, Student A scored in Tests and Quizzes 148 out\nof 200, or a CRS percentage of 74, and we multiply this by .40 since the test and quizzes account for 40%\nof CS (class standing). The Term Paper with a score of 92 has a CRS percentage of 92 is multiplied by the\nassigned weight of .15; Project with score of 90 has a CRS percentage of 90 is multiplied by the assigned\nweight of .10; and Recitation with a score of 87 has a CRS percentage of 87 is multiplied by the assigned\nweight of .35. The weighted CRS's of the elements under CS or class standing are then added. We now have\na total weighted CRS for class standing (82.85). This is then multiplies by .40 since CS accounts for 40% of"", '1. The Grading Scale\nUnder the revised college grading system, letter grades are assigned according an eight (8) level scale\nwith the indicated point values and descriptions, namely:\n2018 Revised Grading System\nGrade & Grade Description\nCFRS\n96-100 | 98-100 Excellent academic performance\n90-95 94-97 Superior academic performance\n84 - 89 90-93 | BR | Very good academic performance\n78 - 83 86 - 89 Good academic performance\n71-77 82 - 85 Moderately good academic performance\n65 - 70 78 - 81 Fair academic performance\n60 - 64 75-77 fo oD Passing academic performance\nBelow 75 Unacceptable academic performance | 0.0 |\n16\n| Student Handbook 2025-2026__INSIDE.indd 180 8/20/25 1:43PM |', 'accuracy,InterquartileRange(IQR)forprecision,CoefficientofVariation(CV)forstability,and\n95%ConfidenceInterval(CI)forreliability.Exceptionalsub-meterACEsof0.615mand0.616m\nwereachievedbythesidehallwaysofthesecondandthirdfloors,respectively,confirminghigh\naccuracywithlowerACEs.Highererrorsattributedtoincreasedmultipathinterferenceare\nexhibitedbythecenterhallways.Acceptableoverallaccuracy(ACE=0.870mforthesecond\nfloorandACE=0.810mforthethirdfloor)isshownforbothfloors,withgoodstability(CV\nvaluesof0.640-0.650)andreliability(CIvaluesof±0.040m).Thisstudyaffirmsthefeasibilityof\nESP32-basedUWBsystemsforeffectivemulti-floorlocalizationwhilehighlightingtheneedto\nconsiderspecificenvironmentalconditions.\nKeywords:multi-floorlocalization,ESP32,ultra-wideband,localizationaccuracy,trilateration', ""N. Recognition of Exemplary Performance\n\nThe University endeavors to create a culture of excellence in the students, and one way to encourage\nexcellent performance is to recognize and reward students who manifest this value in academic as well a\nnon-academic endeavors. Academic awards are conferred to students who reach the OPI requirements\nfor these awards. Non- academic awards are conferred on students for excellence in sports, leadership\nand service. The semestral University and College Recognition Ceremonies are special occasions for\nthe parents, students and the University Community to honor the student achievers.\n\n1. Honors’ Lists\n\nThe following revised criteria shall be implemented for all students beginning SY 2018 - 2019.\n\nThe President's List (University Honors). This list includes all students whose average OPI is 3.60\n\nor above, with no grade lower than B in any subject.\n\nThe Dean’s List (College Honors). This list includes all students whose average OPI is 3.40 or""]","The Average Quality Point Index (QPI) is 3.125, computed as the quotient of the Accumulated Grade (AG) and the Total Units (TU), which is 62.50/20. 

Here is the example in a Markdown table:
| Subject | Units | Grade | Point Value |
| --- | --- | --- | --- |
| CSDC100 | 3 | B | 30 |
| CSDC101 | 3 | B | 30 |
| THS101 |  |  |  |
Average QPI = AG/TU = 62.50/20 = 3.125",3.125,,,,,,6.884035110473633
What is required for the approval of a delayed examination application due to valid causes enumerated in #2 above?,"[""Misrepresentation, tampering of supporting documents and other forms of fraud committed\n\nby any student in relation to his or her application for delayed examination may result to\n\ndisapproval of the request, without prejudice to the imposition of applicable sanctions\nprovided under the College Student Handbook.\n\n4, Exemption from the Delayed Examination Fee. The delayed examination fee shall not be\ncollected when the cause of the student's failure to take the examination as scheduled is any\nof the valid reasons listed in 2.1 above, except 2.7 or work-related causes.\n\n5. Processing of Applications\n5.1 Fordelayed examinations due to the causes enumerated in #2 above with appropriate\n\nsupporting documents, only the approval of the home department chairperson\nis required and this approval is binding on all teachers concerned, regardless of\ndepartment or college."", 'Academic Regulations %% _\n= i\n6.2.1. A student who fails to take the delayed examination as scheduled shall be\ngiven a zero (0) score for the exam, unless approval had been secured for\nanother delayed examination due to the valid reasons listed in no. 2 above\n(except 2.4 or conflict in the regular or original examination schedule). Per\nsubject, the rescheduling of delayed examinations shall be allowed only\nonce, following the same process of application and approval earlier outlined.\n6.2.2 Ateacher who, without valid reasons, fails to give the delayed examination\nas scheduled shall receive sanctions adapted from the schedule given in the\nCollege Faculty Manual for tardiness in reporting to class, to wit:\nInstance of failure to give Sanction\nscheduled delayed exam\nVerbal reminder from the Department Chair\nWritten reminder from the Department Chair\nWritten reprimand from the Department Chair\nTenth or more Ineligibility to receive merit increase and/or valid ground for non-', ""5.2 If the cause of the delayed examination is 2.7 or work-related causes, the student shall\npay the delayed examination fee at the Treasurer's Office and attach the receipt to\nthe application form.\n\n6. Scheduling of Delayed Examinations.\n\n6.1 Once the application for delayed examination is approved, the student shall report\nto each of the concerned subject teachers and arrange for the delayed examination\nschedule.\n\n6.2 The concerned student and teacher are equally responsible in insuring that the delayed\nexamination schedule they have set is followed.\n\n24\n| Student Handbook 2025-2026__INSIDE.indd 188 8/20/25 1:43PM |"", 'for filing of applications and the delayed final examinations.\n2. Valid reasons for delayed examinations and supporting documents. The following are\nconsidered as valid reasons for students to apply for delayed examinations:\npf Reason Supporting Document(s\n2.1 | Death of a family member Death certificate or letter from parent/guardian\ncertifying the death of a family member\nCourt summons/subpoenas\n2.3 | Failure to secure exam permit due | Exam permit bearing a date of issuance after\nto insufficient payment of tuition | the schedule of examinations\nand other fees\n23\n| Student Handbook 2025-2026__INSIDE.indd 187 8/20/25 1:43PM |', '“: { Irn > CHAPTER 4\n2.4 | Conflict in examination schedule Copy of exam schedule or signed note from\nthe department chairperson or the College\nRegistrar about the conflict of schedule\n2.5 | Official school representation Excuse letter approved by the AVP for official\nschool representation\n2.6 | Sickness (inclusive of accidents) Medical certificate or letter from parent about\nsickness in cases of commonly treated but\ncontagious (e.g. sore eyes) or seasonal (e.g.\nflu) illnesses\n2.7 | Work-related causes (only for Certificate of employment and appropriate\nworking students) such as required | document supporting the application (e.g.,\nattendance in a company training | company memorandum)\nor special event, etc.\n\n3. Application Process for Delayed Examinations.Upon request for a delayed examination,\nthe student should submit as attachment to the accomplished application theappropriate\nsupporting documents.', ""1.1 Delayed preliminary, midterm and pre-final examinations must be completed no later\nthan the last day prior to the schedule of the next major exam period (e.g., delayed\npreliminary exams must be taken not later than the last recitation or class day before\nthe midterm exams).\n1.2 Delayed final examinations must be completed no later than the first week of classes\nof the succeeding term, summer sessions included.\n1.3 Applications for delayed preliminary, midterm and pre-final examinations must be filed\nno later than a week before the next scheduled examinations.\n1.4 Aconcerned student may appeal a disapproved application for delayed examination\nto the Dean of his/her Home College.\n1.5 The College Registrar's Office shall announce and/or publish the approved deadlines\nfor filing of applications and the delayed final examinations.\n2. Valid reasons for delayed examinations and supporting documents. The following are"", '6.3 The delayed examination schedule shall be distinct from the regular class schedule so\nas not to unduly lessen the class recitation hours.\n\n6.4 The activity period on appropriate days may be utilized as schedules for delayed\nexaminations.\n\n7. Grading\n\n7.1 Other than the final examinations, a student who fails to take a delayed exam in\nany subject within the prescribed period (e.g.: delayed preliminary exam before the\nmidterm exam) shall receive a zero score for the exam. Thus, the provision in the\ngrading system for incomplete grade due to missed preliminary, midterm and/or pre-\nfinal examination is revoked.', 'Academic Regulations %% _\n= Bs\nB. Term Examinations\nThe Preliminary, Midterm, Pre-final, and Final Examinations are periodic assessments of student\nlearning during the semester. They are conducted orally, in writing, or both, and in announced venues on\nthe schedule calendared by the Academic Council and the Registrar. Not one of them may be foregone\nin favor of a prior or future examination, nor may be substituted with the activities that do not actually\nassess student learning of the lesson coverage for the term, such as tours, seminars, parties and the like.\nThe coverage of the Final Examination particularly is 30% of the first term and 70% of the second term.\nEach student is required to present his/her Examination Slip for each of these examinations.\nC. Delayed Term Examination\n1. On tthe Period for Filing Applications for and Taking the Delayed Examination\n1.1 Delayed preliminary, midterm and pre-final examinations must be completed no later']","For the approval of a delayed examination application due to valid causes enumerated in #2 above, only the approval of the home department chairperson is required, and this approval is binding on all teachers concerned, regardless of department or college, provided that the student submits the application with the appropriate supporting documents.",the approval of the home department chairperson,,,,,,7.124862194061279
What is the deadline for completing delayed final examinations?,"[""1.1 Delayed preliminary, midterm and pre-final examinations must be completed no later\nthan the last day prior to the schedule of the next major exam period (e.g., delayed\npreliminary exams must be taken not later than the last recitation or class day before\nthe midterm exams).\n1.2 Delayed final examinations must be completed no later than the first week of classes\nof the succeeding term, summer sessions included.\n1.3 Applications for delayed preliminary, midterm and pre-final examinations must be filed\nno later than a week before the next scheduled examinations.\n1.4 Aconcerned student may appeal a disapproved application for delayed examination\nto the Dean of his/her Home College.\n1.5 The College Registrar's Office shall announce and/or publish the approved deadlines\nfor filing of applications and the delayed final examinations.\n2. Valid reasons for delayed examinations and supporting documents. The following are"", '7.2 When the student missed the final examinations and is unable to take the delayed\nexamination before the deadline for submission of grades at the end of the semester,\nthe subject teacher shall report an incomplete or “INC” grade and indicate NFE\n(meaning “No Final Exam”) in the column for remarks in the official grading sheet.\nHowever, if there is zero possibitty for the student to obtain a passing grade (e.g., the\nstudent will fail even with a perfect score in the final examinations), the teacher may\nalready report a final grade of “F” and indicate “FENB"" (meaning “final exam has no\nbearing”) under the column for remarks so that the advisement or enrollment for the\nnext term may be facilitated. The CFRS and FINGRD columns are left blank. Agrading\ncomputation is shown belowto illustrate the situation:\n\n25\n| Student Handbook 2025-2026__INSIDE.indd 189 8/20/25 1:43PM |', '6.3 The delayed examination schedule shall be distinct from the regular class schedule so\nas not to unduly lessen the class recitation hours.\n\n6.4 The activity period on appropriate days may be utilized as schedules for delayed\nexaminations.\n\n7. Grading\n\n7.1 Other than the final examinations, a student who fails to take a delayed exam in\nany subject within the prescribed period (e.g.: delayed preliminary exam before the\nmidterm exam) shall receive a zero score for the exam. Thus, the provision in the\ngrading system for incomplete grade due to missed preliminary, midterm and/or pre-\nfinal examination is revoked.', 'for filing of applications and the delayed final examinations.\n2. Valid reasons for delayed examinations and supporting documents. The following are\nconsidered as valid reasons for students to apply for delayed examinations:\npf Reason Supporting Document(s\n2.1 | Death of a family member Death certificate or letter from parent/guardian\ncertifying the death of a family member\nCourt summons/subpoenas\n2.3 | Failure to secure exam permit due | Exam permit bearing a date of issuance after\nto insufficient payment of tuition | the schedule of examinations\nand other fees\n23\n| Student Handbook 2025-2026__INSIDE.indd 187 8/20/25 1:43PM |', 'Academic Regulations %% _\n= Bs\nB. Term Examinations\nThe Preliminary, Midterm, Pre-final, and Final Examinations are periodic assessments of student\nlearning during the semester. They are conducted orally, in writing, or both, and in announced venues on\nthe schedule calendared by the Academic Council and the Registrar. Not one of them may be foregone\nin favor of a prior or future examination, nor may be substituted with the activities that do not actually\nassess student learning of the lesson coverage for the term, such as tours, seminars, parties and the like.\nThe coverage of the Final Examination particularly is 30% of the first term and 70% of the second term.\nEach student is required to present his/her Examination Slip for each of these examinations.\nC. Delayed Term Examination\n1. On tthe Period for Filing Applications for and Taking the Delayed Examination\n1.1 Delayed preliminary, midterm and pre-final examinations must be completed no later', ""5.2 If the cause of the delayed examination is 2.7 or work-related causes, the student shall\npay the delayed examination fee at the Treasurer's Office and attach the receipt to\nthe application form.\n\n6. Scheduling of Delayed Examinations.\n\n6.1 Once the application for delayed examination is approved, the student shall report\nto each of the concerned subject teachers and arrange for the delayed examination\nschedule.\n\n6.2 The concerned student and teacher are equally responsible in insuring that the delayed\nexamination schedule they have set is followed.\n\n24\n| Student Handbook 2025-2026__INSIDE.indd 188 8/20/25 1:43PM |"", ""The faculty and/or the student requesting the change of grade submits to the CASC within one\nsemester after the course was taken. If the course is taken during the first semester, the deadline for\nfiling requests is the last working day of March. If the course is taken during the second semester and\nsummer, the deadline of filing requests is the last working day of October.\n\nFor delayed submission or non-submission of completion form within the above specified period\nin which case the Incomplete Grade automatically turns into an F, both parties (student and/or teacher)\nmay file a change of grade within one semester after the set deadline.\n\nAll files pertaining to the committee's work shall be kept in the VPHE Office.\n\nAll appeals for change of grades must be filed with the Standards Committee seven days before\nGraduation. Beyond this date, no appeal will be entertained by the Standards Committee."", '“: { Irn > CHAPTER 4\n\n| xxx_| xxx | 2600 [| 400 | 500 | 400 [| [| | F Fen |\nThe student in the example has a sub-total or partial CFRS of 39 and needs to get\nat least 21 points more from the final exam to obtain a passing CFRS of at least 60.\nHowever, a perfect score in the final exam will only contribute 20 points. In this case,\nthe final exam will have no bearing, that is, the student has no more chance of passing\nthe course. Hence, the teacher already reflected an ”F” grade and indicated “FENB”\nin the column for remarks.\nHowever, because the taking of examinations has instructional value regardless\nof the outcome, any concerned student who may decide to still take the final\nexamination must be allowed to do so, provided his/her application to take\ndelayed examination(s) is duly processed and approved.']","The deadline for completing delayed final examinations is no later than the first week of classes of the succeeding term, summer sessions included.","no later than the first week of classes of the succeeding term, summer sessions included",,,,,,8.247392654418945
Where should a student pay the delayed examination fee and what should be attached to the application form?,"[""5.2 If the cause of the delayed examination is 2.7 or work-related causes, the student shall\npay the delayed examination fee at the Treasurer's Office and attach the receipt to\nthe application form.\n\n6. Scheduling of Delayed Examinations.\n\n6.1 Once the application for delayed examination is approved, the student shall report\nto each of the concerned subject teachers and arrange for the delayed examination\nschedule.\n\n6.2 The concerned student and teacher are equally responsible in insuring that the delayed\nexamination schedule they have set is followed.\n\n24\n| Student Handbook 2025-2026__INSIDE.indd 188 8/20/25 1:43PM |"", ""Misrepresentation, tampering of supporting documents and other forms of fraud committed\n\nby any student in relation to his or her application for delayed examination may result to\n\ndisapproval of the request, without prejudice to the imposition of applicable sanctions\nprovided under the College Student Handbook.\n\n4, Exemption from the Delayed Examination Fee. The delayed examination fee shall not be\ncollected when the cause of the student's failure to take the examination as scheduled is any\nof the valid reasons listed in 2.1 above, except 2.7 or work-related causes.\n\n5. Processing of Applications\n5.1 Fordelayed examinations due to the causes enumerated in #2 above with appropriate\n\nsupporting documents, only the approval of the home department chairperson\nis required and this approval is binding on all teachers concerned, regardless of\ndepartment or college."", 'for filing of applications and the delayed final examinations.\n2. Valid reasons for delayed examinations and supporting documents. The following are\nconsidered as valid reasons for students to apply for delayed examinations:\npf Reason Supporting Document(s\n2.1 | Death of a family member Death certificate or letter from parent/guardian\ncertifying the death of a family member\nCourt summons/subpoenas\n2.3 | Failure to secure exam permit due | Exam permit bearing a date of issuance after\nto insufficient payment of tuition | the schedule of examinations\nand other fees\n23\n| Student Handbook 2025-2026__INSIDE.indd 187 8/20/25 1:43PM |', ""1.1 Delayed preliminary, midterm and pre-final examinations must be completed no later\nthan the last day prior to the schedule of the next major exam period (e.g., delayed\npreliminary exams must be taken not later than the last recitation or class day before\nthe midterm exams).\n1.2 Delayed final examinations must be completed no later than the first week of classes\nof the succeeding term, summer sessions included.\n1.3 Applications for delayed preliminary, midterm and pre-final examinations must be filed\nno later than a week before the next scheduled examinations.\n1.4 Aconcerned student may appeal a disapproved application for delayed examination\nto the Dean of his/her Home College.\n1.5 The College Registrar's Office shall announce and/or publish the approved deadlines\nfor filing of applications and the delayed final examinations.\n2. Valid reasons for delayed examinations and supporting documents. The following are"", '“: { Irn > CHAPTER 4\n2.4 | Conflict in examination schedule Copy of exam schedule or signed note from\nthe department chairperson or the College\nRegistrar about the conflict of schedule\n2.5 | Official school representation Excuse letter approved by the AVP for official\nschool representation\n2.6 | Sickness (inclusive of accidents) Medical certificate or letter from parent about\nsickness in cases of commonly treated but\ncontagious (e.g. sore eyes) or seasonal (e.g.\nflu) illnesses\n2.7 | Work-related causes (only for Certificate of employment and appropriate\nworking students) such as required | document supporting the application (e.g.,\nattendance in a company training | company memorandum)\nor special event, etc.\n\n3. Application Process for Delayed Examinations.Upon request for a delayed examination,\nthe student should submit as attachment to the accomplished application theappropriate\nsupporting documents.', 'Academic Regulations %% _\n= i\n6.2.1. A student who fails to take the delayed examination as scheduled shall be\ngiven a zero (0) score for the exam, unless approval had been secured for\nanother delayed examination due to the valid reasons listed in no. 2 above\n(except 2.4 or conflict in the regular or original examination schedule). Per\nsubject, the rescheduling of delayed examinations shall be allowed only\nonce, following the same process of application and approval earlier outlined.\n6.2.2 Ateacher who, without valid reasons, fails to give the delayed examination\nas scheduled shall receive sanctions adapted from the schedule given in the\nCollege Faculty Manual for tardiness in reporting to class, to wit:\nInstance of failure to give Sanction\nscheduled delayed exam\nVerbal reminder from the Department Chair\nWritten reminder from the Department Chair\nWritten reprimand from the Department Chair\nTenth or more Ineligibility to receive merit increase and/or valid ground for non-', '6.3 The delayed examination schedule shall be distinct from the regular class schedule so\nas not to unduly lessen the class recitation hours.\n\n6.4 The activity period on appropriate days may be utilized as schedules for delayed\nexaminations.\n\n7. Grading\n\n7.1 Other than the final examinations, a student who fails to take a delayed exam in\nany subject within the prescribed period (e.g.: delayed preliminary exam before the\nmidterm exam) shall receive a zero score for the exam. Thus, the provision in the\ngrading system for incomplete grade due to missed preliminary, midterm and/or pre-\nfinal examination is revoked.', '2. Once finished, wait for 2 to 3 working days for an email containing your username, password, and\nwebsite link. Then, fill out the online form and submit it.\nif\n3. Then, please wait for the email confirming your exam schedule. You may pay the testing fee\nonsite or offsite. Details on how to pay offsite will also be included in the confirmation email. The\n\ntesting fee is Php 200.00.\n\nIf you have not paid the testing fee yet, you may pay on the day of the exam but please bring\nthe following:\n\n¢ — Ipc. 2x2 white background picture (studio taken)\n\n¢ — School ID or any identification with picture\n4. Lastly, download the application form and bring the necessary requirements on the day of the exam\n\n41\n| Student Handbook 2025-2026__INSIDE.indd 205 8/20/25 1:43PM |']",The student shall pay the delayed examination fee at the Treasurer's Office and attach the receipt to the application form.,The student shall pay the delayed examination fee at the Treasurer's Office and attach the receipt to the application form.,,,,,,7.6529765129089355
What is the maximum number of units a student on academic probation can enroll in for the next semester?,"[""Academic Regulations = s\nI. Academic Probation\n\nA student who obtains a OPI below 1.5, in all subjects for the semester is placed on Academic\nProbation in the next semester. A student already on academic probation who still merits a succeeding\nAcademic Probation is not allowed to enroll in more than 18.5 units (PE and NSTP included) in the next\nsemester. Moreover, the Department Chairperson in consultation with the student's counselor regulates\nthe subject load of said student.\n\nJ. College Reading Program\n\nAll incoming college freshman students and transferees of Ateneo de Naga University are re-\nquired to take the College Reading Program except those who had finished a bachelor's degree prior\nto enrollment of their present course. Incoming college freshman students who finished senior high\nschool in the University and were issued a Certificate of Proficiency are also exempted from taking\nthe College Reading Program."", ""or above, with no grade lower than B in any subject.\n\nThe Dean’s List (College Honors). This list includes all students whose average OPI is 3.40 or\n\nabove, with no failing grade in any subject.\n\nTo qualify for the President's or Dean’s Lists, a student must:\n\na. havea load of at least eighteen (18) curriculum units during the semester,\n\nb. not have been found guilty of intellectual or academic dishonesty and/or discipline cases\nclassified as grave offenses within the semester.\n\n34\n| Student Handbook 2025-2026__INSIDE.indd 198 8/20/25 1:43PM |"", '""3 { Irn CHAPTER 9 - Appendix B\nlil. Implementing Guidelines\n\nA. — ForEnrolling Students. Those allowed to enroll in Philosophy and Theology courses\nduring the summer must meet the following conditions:\n\n1. They are students with backlog in terms of credit units, specifically, those\nwho have failures, stopped schooling, under-loaded due to work; AND must\nhave taken at least one Philosophy or Theology subjects during the previous\ntwo semesters (this second clause applies to regular students but not to re-\nadmitted ones).\n\n2. Theirtotal maximum load, that is, Philosophy or Theology courses together with\nnon-Theology and non-Philosophy subjects, is 9 units unit only; no overload\nis permitted.\n\n3. They have taken the necessary pre-requisites for the intended Philosophy or\nTheology courses to be enrolled in.', '19. Request to excuse a student in his/her classes to Participate or represent the school in local, regional,\nnational or international events is subject to approval by the Vice President for Higher Education\n(VPHE). The VPHE has the authority to disapprove such request if he/she is in academic probation\nstatus or is a candidate for AF (failure due to excessive absences), or if he/she is in disciplinary\nprobation, as advised by OSA.\n\n20. Organizing units or persons are enjoined to observe due diligence in conducting student activities\nto ensure the safety and security of the participants, especially students. Here are some safety\nand security measures:', 'All freshman college students and transferees must finish their reading requirements in two\ncurriculum years based on their earned units. Failure to comply the requirement would mean being\nblocked from taking any major subjects in the following semester and non-re-admittance thereafter.\nK. Withdrawal from or Dropping a Subject', ""12 semesters, exclusive of summers). In the reckoning of the six (6) school years (or 12\n\nsemesters exclusive of summers) prescribed for completing the degree program for eli-\n\ngibility for degree honors, approved withdrawals of enrollment in regular semesters and\nperiods of non-enrollment covered by leaves of absence (LOA) filed no later than 15 class\ndays after the start of the semester shall be excluded. The College Registrar's Office shall\nprovide the guidelines and procedures for filing by students of leaves of absences.\n\nd. not been found guilty of any of the following:\n\n* tampering with and/or falsifying school or public documents and/or communica-\ntion, or securing or using such documents whether physical or electronic, especially\nthose that are part of, or affect, the official processes of the University,\n\n¢ cheating or any form intellectual or academic dishonesty, and\n\n* grave offenses listed in the Student Handbook"", 'd. Malversation of funds collected from the students\ne. Misrepresentation in the application for school-sponsored awards (e.g. graduation awards) or\nschool representation/nomination to external searches/competitions/programs\nf. Any other forms of dishonesty\n6. Offenses against Public Morals\na. Accessing, possessing or distributing pornographic materials on campus, whether in physical\nor electronic form\nb. Engaging in, or provoking, scandalous behavior on campus or during a school-sanctioned function\nc. Any form of public immorality\nWhen the penalty imposed on a student is short of dismissal, i.e., suspension and/or reprimand,\nthe student concerned will be placed on “Strict Disciplinary Probation Status” (SDPS) for not less than\none semester but not more than one academic year.\n* Exception: Sharing private communications is permitted only when done for legitimate purposes,\nincluding but not limited to:', 'grade of the student, and the beadle forwards the form to OSA for the Dean’s notation.\n12. All AF forms submitted to OSA are considered final.\nStudents who incurred excessive absences in a previous semester based on OSA report will\nbe required to sign a promissory note indicating that he/she will improve his/her attendance\nand report to the guidance counselor assigned to him/her for the semester.\nFailure to improve class attendance will merit reductions of academic load in the succeeding\nsemester.\nMake-up classes are voluntary. No exams are scheduled during make-up classes.\nAny student who accumulates absences beyond the number of class hours stated above\nshall receive a final grade of AF.\n32\n| Student Handbook 2025-2026__INSIDE.indd 196 8/20/25 1:43PM |']",A student on academic probation is not allowed to enroll in more than 18.5 units (PE and NSTP included) in the next semester.,18.5 units (PE and NSTP included),,,,,,7.664863586425781
What is the duration for which a student will be placed on Strict Disciplinary Probation Status after receiving a penalty short of dismissal,"['6. Disciplinary Warning Status\n\n7. Loss of privileges related to the nature and circumstances of the offense\n\nPenalties for Grave Offenses:\n\n1. Strict Disciplinary Status. The duration and conditions of which shall be recommended by\nthe Disciplinary Board and approved by the University President. Automatic dismissal shall be\ngiven if any of the conditions is violated.\n\n95\n| Student Handbook 2025-2026__INSIDE.indd 259 8/20/25 1:44PM |', 'd. Malversation of funds collected from the students\ne. Misrepresentation in the application for school-sponsored awards (e.g. graduation awards) or\nschool representation/nomination to external searches/competitions/programs\nf. Any other forms of dishonesty\n6. Offenses against Public Morals\na. Accessing, possessing or distributing pornographic materials on campus, whether in physical\nor electronic form\nb. Engaging in, or provoking, scandalous behavior on campus or during a school-sanctioned function\nc. Any form of public immorality\nWhen the penalty imposed on a student is short of dismissal, i.e., suspension and/or reprimand,\nthe student concerned will be placed on “Strict Disciplinary Probation Status” (SDPS) for not less than\none semester but not more than one academic year.\n* Exception: Sharing private communications is permitted only when done for legitimate purposes,\nincluding but not limited to:', ""r i (re CHAPTER 7\n\n2. Suspension. MoRPHE's Suspension deprives or denies the erring student from attending his/\n\nher in classes and school activities for a definite period of time during a semester. The student\nshall be reinstated in the school after the duration of suspension and upon compliance with the\nsanctions and interventions as stated in the decision. During the period of suspension, the erring\nstudent's credentials are withheld.\nA student under investigation of a case involving the penalty of suspension, dismissal or expul-\nsion may be preventively suspended from entering the school premises if the evidence of guilt is\nstrong and/or the school head is morally convinced that the continued stay of the student during\nthe period of investigation constitutes sufficient distraction to the normal operation of the school\nor poses real or imminent threat or danger to persons and property in the school's premises and\nactivities."", ""a) One of the parties initiates the amicable settlement.\n\nb) Both parties mutually agree to the terms of settlement.\n\nc) The nature of the offense is deemed minor per the initial assessment of the DSA.\n\nd) This is the first complaint against the respondent, or the alleged offender has no prior\nor pending disciplinary case.\n\nEven if an amicable settlement is reached, the respondent will still be placed on\n\ndisciplinary probation upon admitting to the offense and must sign the Behavioral\n\nContract Agreement to adhere to established behavioral standards.\n\n8. After establishing the facts, the DSA will assess the severity of the offense and the evidence\nof guilt or innocence. The student's previous disciplinary records may be considered in the\nequation.\n\n9. For minor offenses, the DSA will impose an appropriate penalty, which is executory."", ""4. Other forms of violence as may be determined by the school's disciplinary bodies.\n\nB. Penalties\n\n1. Violation of this policy is considered grave and merits non-readmission, dismissal or expulsion\nas a disciplinary sanction.\n\n2. The OSA may temporarily suspend the recognition/accreditation of any organization\ncomplained to have violated this policy, pending the results of the school's disciplinary\nprocedures.\n\n3. Anyschool’s decision which meted out the penalty of non-readmission, dismissal or expulsion\nshall be reflected on the involved student/s’ scholastic record. (per Section 13 of R.A. 11053\n\nAny ADNU employee involved in the organization and/or the organization's hazing activity or\n\nother forms of violent initiation shall be reported to the Human Resource Management Office for\n\nproper investigation and disciplinary proceeding.\nIX. Transitory Provisions"", ""4. Dismissal. Dismissal or dropping terminates the student's status as a student of the University.\nOnce an erring student is dismissed, he/she becomes ineligible for readmission to the Univer-\nsity. The dismissed student shall be issued his/her transfer credentials upon compliance with\nthe sanctions and interventions as stated in the decision, and completion of the school's clear-\nance process and requirements. He/She is not entitled to Honorable Dismissal and Certificate of\nGood Moral Character."", 'Students who are dismissed or expelled from the university are not entitled to receive a CGMC.\n\nIn cases where students have not yet complied with the sanctions and penalties due to a grave\n\noffense, they will not be eligible for a CGMC. However, once they have completed the required\npenalties, they will be entitled to a revised CGMC indicating their compliance with the requirements.\n\nFor individuals who are respondents in a disciplinary case, they must obtain clearance from OSA', 'programs, etc. are sent to the department chair and the parents/\nguardians of the said student;\n_ ; - Letter of Apology;\n12. Coercion or aiding in any manner In - Community service as decided upon by OSA;\nthe commission of plagiarism and - Non-readmission, the duration of which is decided by\nfabrication or falsification of data/ OSA or the Disciplinary Board;\nresults with regard to the fulfillment - Dismissal;\nof a degree’s requirements like theses | _ Combination of any of these sanctions;\nand senior projects;\n13. Three instances of guilt in any of the - Dismissal\nabove.\n116\n| Student Handbook 2025-2026__INSIDE.indd 280 8/20/25 1:44PM |']","The student will be placed on ""Strict Disciplinary Probation Status"" (SDPS) for not less than one semester but not more than one academic year.",not less than one semester but not more than one academic year,,,,,,3.896752119064331
What happens to a student's credentials during the period of suspension?,"[""r i (re CHAPTER 7\n\n2. Suspension. MoRPHE's Suspension deprives or denies the erring student from attending his/\n\nher in classes and school activities for a definite period of time during a semester. The student\nshall be reinstated in the school after the duration of suspension and upon compliance with the\nsanctions and interventions as stated in the decision. During the period of suspension, the erring\nstudent's credentials are withheld.\nA student under investigation of a case involving the penalty of suspension, dismissal or expul-\nsion may be preventively suspended from entering the school premises if the evidence of guilt is\nstrong and/or the school head is morally convinced that the continued stay of the student during\nthe period of investigation constitutes sufficient distraction to the normal operation of the school\nor poses real or imminent threat or danger to persons and property in the school's premises and\nactivities."", ""3. Non-Readmission. MoRPHE's Non-Readmission denies or deprives a student to enroll for a\nsemester or school year following the semester when the resolution or decision finding him/her\nresponsible of the offense charged and imposing the penalty of non-readmission was promul-\ngated. The student may be reinstated in the school after the duration of non-readmission and\nupon compliance with the sanctions and interventions as stated in the decision. If during the\nperiod of non-readmission, the erring student decides to transfer to another school, he/she may\nbe issued transfer credentials upon compliance with the required sanctions and interventions,\nand completion of the school's clearance process and requirements, but he/she is not entitled\nto Honorable Dismissal and Certificate of Good Moral Character."", 'or demonstrate full compliance with all penalties (up to non-readmission only) and requirements before\nthey are allowed to re-enroll or be readmitted to the university. Furthermore, the OSA has the authority\nto issue a hold order on the processing and issuance of CGMC, as well as other school certifications and\ncredentials, until the concerned student respondent in a decided case has fully served all the sanctions\nand fulfilled all other requirements.\nIMPORTANT NOTE:\nSome provisions in this chapter may be revised or suspended during the pandemic. Please read the\nOnline Handbook, which contains other relevant policies and guidelines thru the following link. Further,\nkindly read the official university announcements and memoranda thru the Gbox/Email System and\nsocial media platforms.\nSCAN THIS\nEprdcl\nage aH\npons OS by\npar va\nia\nrafee\nAer.\n97\n| Student Handbook 2025-2026__INSIDE.indd 261 8/20/25 1:44PM |', ""4. Dismissal. Dismissal or dropping terminates the student's status as a student of the University.\nOnce an erring student is dismissed, he/she becomes ineligible for readmission to the Univer-\nsity. The dismissed student shall be issued his/her transfer credentials upon compliance with\nthe sanctions and interventions as stated in the decision, and completion of the school's clear-\nance process and requirements. He/She is not entitled to Honorable Dismissal and Certificate of\nGood Moral Character."", 'i. cautioned or reprimanded; or\nii, required to pay for damages or expenses; or\niit. fined; or\niv. suspended from using a facility; or\nv. suspended from the University; or\nvi. given a combination of the above penalties;\nvii. dismissed or expelled.\nThe University reserves the right to turn the matter over to the Police or any pertinent law\nenforcement agency when necessary.\nIMPORTANT NOTE:\nSome provisions in this chapter may be revised or suspended during the school year. Kindly read the\nofficial university announcements and memoranda thru the Gbox/Email System, official social media\nplatforms, or the following link.\nSCAN THIS\nEipredcl\naa wth\n[a] exis a\n111\n| Student Handbook 2025-2026__INSIDE.indd 275 8/20/25 1:44PM |', '5. Fifth offense (of any minor violation) will be issued a final warning plus a corresponding fine\nof P1,000.00.\n\n6. After the Fifth offense (of any minor violation), the gate/pass will be revoked and the vehicle\nmay no longer enter the campus.\n\n7. Payment of FINES will be paid within five days after the date of citation at the Treasurer Of-\nfice copy of receipt should be submitted to the Office of Administrative Services. Failure to\npay such fines within the deadline will result to suspension of the gate pass/entry the vehicle\nwill not be allowed to enter.\n\n8. Copies of the reprimand letters for habitual violators (Third Offense) will be sent to the Office of\nStudent Affairs for students and the Human Resource Development Office for faculty and staff.\n\nSerious Violations\n\n1. An incident report will be submitted to the OAS by the security personnel.', 'Students who are dismissed or expelled from the university are not entitled to receive a CGMC.\n\nIn cases where students have not yet complied with the sanctions and penalties due to a grave\n\noffense, they will not be eligible for a CGMC. However, once they have completed the required\npenalties, they will be entitled to a revised CGMC indicating their compliance with the requirements.\n\nFor individuals who are respondents in a disciplinary case, they must obtain clearance from OSA', ""4. Other forms of violence as may be determined by the school's disciplinary bodies.\n\nB. Penalties\n\n1. Violation of this policy is considered grave and merits non-readmission, dismissal or expulsion\nas a disciplinary sanction.\n\n2. The OSA may temporarily suspend the recognition/accreditation of any organization\ncomplained to have violated this policy, pending the results of the school's disciplinary\nprocedures.\n\n3. Anyschool’s decision which meted out the penalty of non-readmission, dismissal or expulsion\nshall be reflected on the involved student/s’ scholastic record. (per Section 13 of R.A. 11053\n\nAny ADNU employee involved in the organization and/or the organization's hazing activity or\n\nother forms of violent initiation shall be reported to the Human Resource Management Office for\n\nproper investigation and disciplinary proceeding.\nIX. Transitory Provisions""]","During the period of suspension, the erring student's credentials are withheld.",The student's credentials are withheld,,,,,,6.3690385818481445
Which office is responsible for the issuance of Car Pass Stickers?,"[""4. The gate pass/sticker is applied for and is renewed on a yearly basis, from April to May 31 and is\nvalid for one year from June 1 to May 31, subject to renewal. The application forms for gate pass/\nsticker shall be done at OAS, while payments for the gate pass/sticker are settled at Treasurer's\nOffice. The following are needed when applying for gate/pass sticker; Photocopies of Driver's\nLicense, Certificate of Registration of the Vehicle, and LTO Official Receipt.\n\n5. Issuance of car gate pass/sticker will be color coded:"", '5. Issuance of car gate pass/sticker will be color coded:\n\nEMPLOYEES\nCircle Gate-Pass Stickers\nEC1.) Sticker with restrictions to enter - the following colors may not enter the campus on their\nassigned day\n(Monday - Black, Tuesday - Blue, Wednesday - White, Thursday - Green, Friday - Red)\n¢ Applicable to all employees with cars who wish to park inside the campus, subject to a one\n(1) day entry restriction.\ne Each employee is entitled to one (1) gate pass sticker for one (1) registered vehicle only.\n184\n| Student Handbook 2025-2026__INSIDE.indd 348 8/20/25 1:45PM |', '“ ye CHAPTER 9 - Appendix N\n\nSECTION I. AUTHORITIES AND ADMINISTRATION\nThe Office of Administrative Services (OAS) is the office responsible for monitoring and regulat-\n\ning traffic and parking of vehicles coming in/out of the campus. With coordination with the Physical\n\nPlant Administration, they are responsible with the development and designation of parking areas in\n\nthe campus.\n\nThe OAS, being the one responsible for the implementation of the traffic and parking policies,\nhas the authority to cite traffic or parking violations, and in dire cases suspend the gate pass issued to\nvehicle owners who later turn out to be persistent violators.\n\nThe President has the authority, through consultation with the Council of Administrators and\nrecommendation of the OAS, to change or modify any traffic or parking policies in Ateneo de Naga\nUniversity.\n\nSECTION II. RULES & PROCEDURES\n\nA. Gate Pass/Sticker', '7. Students are responsible to use school property with care. A student who causes damage or loss\nto the property of the school is subject to disciplinary measures and/or is required to replace the\n\n’ damaged or lost property.\n\n8. Library rules and sanctions are designed to guarantee optimum use of the library to the university\ncommunity.\n\nThe University Librarian refers all infractions or offenders to the Office of Student Affairs (OSA) for\nappropriate action.\n\n9. Students must register their cars and procure the gate pass sticker from the Office of Administrative\nServices (or OAS, for brevity). They must park only in designated areas and avoid unnecessary blowing\nof horns. For the guidance of students concerned, a copy on the policy on car gate pass/sticker,\nparking and traffic management, can be secured at OAS.\n\n79\n| Student Handbook 2025-2026__INSIDE.indd 243 8/20/25 1:43PM |', '. { | (ki CHAPTER 9 - Appendix N\n\n6. The cost of the gate/pass sticker will be recommended by the OAS to the President, and subse-\nquently a memo will be issued to inform the University before the start of the school year.\n\n7. This gate pass/ sticker must be placed on the upper right portion of the windshield and outside\nthe vehicle where a Security Officer can readily inspect it. Hanging laminated gate pass/sticker\ninside the vehicle is not allowed. For motorbikes, the sticker may be placed wherever deemed\nappropriate by the owner. The security personnel will be the one to place gate pass/sticker on to\nthe vehicles in the presence of the owner or representative.\n\n8. The gate pass/sticker does not in any way substitute for or supersede the ID rule for all students\nand employees. Any student-passenger inside any vehicle with issued stickers, may still be barred\nentrance when s/he does not have the proper identification card.', 'Policy Statement On Campus Traffic Management =“ : :\n9. Drunk driving or driving under the influence of drugs; bringing in of drugs, guns (except for guards\nof the university depository banks), deadly weapons and other illegal items are strictly prohibited.\n10. Students, faculty and staff members who refuse to allow the security personnel to inspect their\nvehicles shall be reported to OAS, after which the latter shall refer it to the Office of Student Affairs\n(for students) or the Human Resource Management Office (for faculty/staff).\nD. Violations\nD.1 Serious Violations:\n1. Selling, attempting to sell, or giving their gate pass/sticker to another person.\n2. False declaration in any application for a gate pass/sticker or in a report of a stolen gate\npass/sticker.\n3. Tampering/Falsification/Alteration or Duplication of gate pass/sticker.\n4. Driving while under the influence of prohibited drugs or any alcoholic beverages.', 'SECTION II. RULES & PROCEDURES\n\nA. Gate Pass/Sticker\n\n1. Generally for security reasons, all vehicles (cars and motorbikes) entering the campus shall bear\nthe Ateneo de Naga University Gate Pass/Sticker.\n\n2. All vehicles with gate pass/sticker should strictly comply with the traffic rules and regulations in\nthe campus. The gate pass/sticker is for entry and security purposes and not a parking privilege,\ngiven limited space.\n\n3. Nogate pass/sticker / No entry policy will be strictly implemented starting the month of July every\nschool year. Regular or special visitors who have business dealings with the University, however,\nare issued a temporary entry permit.', 'e Each student is entitled to one (1) gate pass sticker for one (1) registered vehicle only.\nSR2.) Stickers for Drop-off & Pick-up only\nColor: Yellow\ne There are no restrictions on entering the campus, but parking inside is prohibited.\n¢ Applicable to ACLC up to Grade 11 Students.\ne SHS Grade 12, College, College of Law, and Graduate School students who own cars and\nintend for drop-off and pick-up may also apply for this sticker.\n¢ Motorcycles, e-bikes, and tricycles are allowed to park with this sticker.\nCONCESSIONAIRES/DELIVERY\nRectangular Gate-Pass Stickers\nCR1.) Stickers for Drop-off & Pick-up only\n(Purple)\ne Entry is permitted with these stickers; parking inside the campus is prohibited.\nNOTE: This policy imposes restrictions from Monday to Friday, 6:00 a.m. to 5:00 p.m., with evenings,\nSaturdays and Sundays exempted.\n185\n| Student Handbook 2025-2026__INSIDE.indd 349 8/20/25 1:45PM |']","The Office of Administrative Services (OAS) is responsible for the issuance of Car Pass Stickers, while payments are settled at the Treasurer's Office.",Office of Administrative Services,,,,,,5.888877868652344
