user_input,retrieved_contexts,response,reference,context_precision,context_recall,faithfulness,answer_correctness,answer_relevancy,confidence_score
What are the requirements to shift to Computer Engineering?,"[""**BS ECE — 4th year**\n\n## 4th year\r\n\n## BS ECE — Fourth Year — 1st Semester\r\n| Course Code | Course Title | Units | Pay Units Lec | Pay Units Lab | Co-requisites | Prerequisites |\r\n|---|---|---|---|---|---|---|\r\n| None | GEC Elective 2 (Non-Credit Subject (Optional): Upon completion of ALL Computer Networks Professional Electives, QECE001, QECE002, QECE003, students can opt to apply for certifications: Cisco Certified Networking Associate (CCNA)) | 3 | 3 | 0 | None | none |\r\n| SOCS102 | Reading in Philippine History | 3 | 3 | 0 | None | none |\r\n| QECC040 | Seminars/ Colloquium/Fieldtrips | 1 | 0 | 3 | None | Fourth Year Standing |\r\n| QECC220 | Engineering Design 1 /Capstone Project 1 | 1 | 0 | 3 | None | QECC010, GEAL102, QECC210 |\r\n| QECP441 | Engineering Communication 4 Lecture: Data Communications | 3 | 3 | 0 | QECP442 | QECP421, QECP422 |\r\n| QECP442 | Engineering Communication 4 Laboratory: Data Communications | 1 | 0 | 3 | QECP441 | QECP421, QECP422 |\r\n| QECP431 | Engineering Communication 3 Lecture: Transmission Media and Antenna System | 3 | 3 | 0 | QECP432 | QECP411, QECP412, QECP020 |\r\n| QECP432 | Engineering Communication 3 Laboratory: Transmission Media and Antenna System | 1 | 0 | 3 | QECP431 | QECP411, QECP412, QECP020 |\r\n| GEAL103 | Engineering Management | 2 | 2 | 0 | None | None |\r\n| QECE003 | Professional Elective 3 (Non-Credit Subject (Optional): Upon completion of ALL Computer Networks Professional Electives, QECE001, QECE002, QECE003, students can opt to apply for certifications: Cisco Certified Networking Associate (CCNA)) | | | | None | QECE002 |\r\n| None | Total Number of Units | 18 | 26 | None | None | None |\r\n\n## BS ECE — Fourth Year — 2nd Semester\r\n| Course Code | Course Title | Units | Pay Units Lec | Pay Units Lab | Co-requisites | Prerequisites |\r\n|---|---|---|---|---|---|---|\r\n| None | GEC Elective 3 (Maybe credited as GE Elective) | 3 | 3 | 0 | None | None |\r\n| SOCS103 | The Contemporary World | 3 | 3 | 0 | None | SOCS102 |\r\n| SOCS104 | The Life and Works of Rizal | 3 | 3 | 0 | None | None |\r\n| THEN103 | Christian Vocation: Love, Family Life and Society (Maybe credited as GE Elective) | 3 | 3 | 0 | None | THEN102, PHIN103 |\r\n| QECC020 | ECE/CpE Laws, Contracts, Ethics & Standards | 3 | 3 | 0 | None | PHIS102 |\r\n| QECC230 | Engineering Design 2 /Capstone Project 2 | 2 | 0 | 6 | None | QECC220 |\r\n| None | Professional Elective 4 | 4 | 3 | 3 | None | Fourth Year Standing |\r\n| None | Professional Elective 5 | 4 | 3 | 3 | None | Fourth Year Standing |\r\n| None | Total Number of Units | 25 | 33 | None | None | None |\r\n\n## Professional Electives\r\n\n| Course Code | Course Title | Units | Prerequisites |\r\n|---|---|---|---|\r\n| QECE001 | Computer Networks 1 | 4 | QECE001 |\r\n| QECE002 | Computer Networks 2 | 4 | QECE002 |\r\n| QECE003 | Computer Networks 3 | 4 | QCP431, QCP432 |\r\n| QECE450 | Advanced Communication System & Design | 4 | QECP431, QECP432, QECP441, QECP442 |\r\n| QECE460 | Advanced Networking | 4 | QECP131, QECP132, QECP020 |\r\n| QECE140 | Advanced Power Supply Systems | 4 | QECP511, QECP512 |\r\n| QECE520 | Advanced Instrumentation and Control | 4 | QECP310 |\r\n| QECE320 | Advanced DSP | 4 | None |\r\n| QECE005 | Internet of Things (IoT) Fundamentals | 4 | None |\r\n\n## Others:\r\n1. Introduction to Catholic Faith: Non-credit, required for all non-Catholic and graduates of non-Catholic Senior High School before taking THEN101.\r\n2. Two required Jesuit Core Courses, namely THEN103 (Christian: Love, Family Life, and Society) and PHIN101 (Logical and Critical Thinking), as developed, comply with the criteria for the design of GE Elective Courses. As such, students may also opt to have any of these courses credited as a GE Elective. Consequently, the total credit units earned may be reduced by the same number of Jesuit Core units credited towards the required GE Electives.\r\n3. The College SRA must be finished within the first two curriculum years.\r\n4. Seniors' Retreat and Community Outreach Program are requirements for graduation."", '[GENERAL] CSEA Organizational Structure 1st sem SY 2025 2026\n\nFULL-TIME FACULTY \n●\u200b ENGR. ANACLETO A. CASIMIRO - Master of Science in Electronics & Communications \nEngineering \n●\u200b ELMER C. CLAVERIA JR. - Bachelor of Science in Computer Science \n●\u200b ENGR. EUGENE T. DY - Master of Science in Electronics Engineering \n●\u200b ENGR. CORNELIO G. LABRADOR II - Master of Science in Electronics and \nCommunications Engineering \n●\u200b DR. JOEL R. NOCHE - Doctor of Philosophy in Education major in Mathematics \n●\u200b ENGR. CARLO GIOVANNI E. OLIVAN - Bachelor of Science in Computer Engineering \n(on study leave) \n●\u200b ENGR. JEAN PAUL I. PAJE - Master of Physics \n●\u200b ENGR. KARLA LOUISSA MARIE D. SOBREVILLA - Master of Engineering in Computer \nEngineering \nPART-TIME FACULTY \n●\u200b ENGR. FRANCISCO S. CUETO - Bachelor of Science in Civil Engineering \n●\u200b ENGR. GEORGETTE F. GESMUNDO - Bachelor of Science in Civil Engineering \n●\u200b ENGR. RYAN ALVIN O. MERCADO - Master of Science in Electronics & \nCommunications Engineering', '[GENERAL] CSEA\n\nCOLLEGE OF SCIENCE, ENGINEERING, AND ARCHITECTURE \n\nThe College of Science, Engineering, and Architecture excels with board exam results \nsurpassing national averages. It boasts PAASCU-accredited programs and well-equipped \nlaboratories for hands-on learning. Students are engaged in community-based research and \nintegrated Service Learning Program (SLP). They also benefit from strong industry and LGU \npartnerships, shaping a practical, industry-relevant education. \n\nHIGHLIGHTS \n\n●\u200b 2023 UNESCO World Engineering Day Hackathon Winner: Team SPONGE \n●\u200b The Golden Builders - Ranked First in the Skills Olympics 2023 Digital Road Design \nCompetition. \n●\u200b The only university in Bicol using a BIM Laboratory / Smart Laboratory. \n\nCOURSES \n\n●\u200b BS Architecture \n●\u200b BS Biology \n●\u200b BS Civil Engineering \n●\u200b BS Computer Engineering \n●\u200b BS Electronics Engineering \n●\u200b BS Environmental Management \n●\u200b BS Mathematics \n●\u200b Bachelor of Engineering Technology major in Computer Engineering Technology', '**BS ECE — 2nd year**\n\n## 2nd year\r\n\n## BS ECE — Second Year — 1st Semester\r\n| Course Code | Course Title | Units | Pay Units Lec | Pay Units Lab | Co-requisites | Prerequisites |\r\n|---|---|---|---|---|---|---|\r\n| CRCP003 | SRA Reading Program 3 | [1.5] | 1.5 | 0 | None | None |\r\n| NSTP101 | National Service Training Program (CWTS) 1 | 3 | 3 | 0 | None | CIFP102 |\r\n| ENGS101 | Purposive Communication | 3 | 3 | 0 | None | none |\r\n| PHIN102 | Philosophical Anthropology | 3 | 3 | 0 | None | PHIN101 |\r\n| QECP111 | Engineering Electronics 1 Lecture: Electronic Devices and Circuits | 3 | 3 | 0 | QECP112 | QECA221, QECA222, QECA020 |\r\n| QECP112 | Engineering Electronics 1 Laboratory: Electronic Devices and Circuits | 1 | 0 | 3 | QECP111 | QECA221, QECA222 |\r\n| QECA311 | Engineering Electric Circuits 1 Lecture | 3 | 3 | 0 | QECA312 | QECA221, QECA222 |\r\n| QECA312 | Engineering Electric Circuits 1 Laboratory | 1 | 0 | 3 | QECA311 | QECA221, QECA222 |\r\n| GEMT103 | Differential Equations | 3 | 3 | 0 | None | GEMT102 |\r\n| GEAL101 | Engineering Data Analysis (with laboratory fees) | 3 | 3 | 0 | None | GEMT102 |\r\n| QECA010 | Object Oriented Programming for ECE | 2 | 0 | 6 | None | none |\r\n| None | Total Number of Units | 25 | 34.5 | None | None | None |\r\n\n## BS ECE — Second Year — 2nd Semester\r\n| Course Code | Course Title | Units | Pay Units Lec | Pay Units Lab | Co-requisites | Prerequisites |\r\n|---|---|---|---|---|---|---|\r\n| CRCP004 | SRA Reading Program4 | [1.5] | 1.5 | 0 | None | None |\r\n| NSTP102 | National Service Training Program (CWTS) 2 | 3 | 3 | 0 | None | NSTP101 |\r\n| PHIS102 | Ethics | 3 | 3 | 0 | None | PHIN102 |\r\n| QECP121 | Engineering Electronics 2 Lecture: Electronic Circuit Analysis and Design | 3 | 3 | 0 | QECP122 | QECP111, QECP112 |\r\n| QECP122 | Engineering Electronics 2 Laboratory: Electronic Circuit Analysis and Design | 1 | 0 | 3 | QECP121 | QECP111, QECP112 |\r\n| QECA321 | Engineering Electric Circuits 2 Lecture | 3 | 3 | 0 | QECA322 | QECA311, QECA312 |\r\n| QECA322 | Engineering Electric Circuits 2 Laboratory | 1 | 0 | 3 | QECA321 | QECA311, QECA312 |\r\n| QECP010 | Advanced Mathematics for ECE | 3 | 3 | 0 | None | GEMT103, QECA010 |\r\n| QECP211 | Digital Electronics 1 Lecture: Logic Circuits and Switching Theory | 3 | 3 | 0 | QECP212 | QECP111, QECP112 |\r\n| QECP212 | Digital Electronics 1 Laboratory: Logic Circuits and Switching Theory | 1 | 0 | 3 | QECP211 | QECP111, QECP112 |\r\n| QECP020 | Engineering Electromagnetics | 4 | 4 | 0 | None | GEMT103 |\r\n| None | Total Number of Units | 26 | 35.5 | None | None | None |', '[GENERAL] CSEA Organizational Structure 1st sem SY 2025 2026\n\n●\u200b ENGR. RYAN ALVIN O. MERCADO - Master of Science in Electronics & \nCommunications Engineering \n●\u200b DR. CELESTE M. OJEDA - Doctor of Philosophy in Electronics Engineering \n●\u200b DR. REFERENDO D. SORIANO - Doctor of Philosophy in Electrical & Electronics \nEngineering \nOFFICE STAFF \n●\u200b GERALD P. BELANO - Lab Technician/Custodian (Bachelor of Science in Food \nTechnology) \n●\u200b DARYL SID F. REALUBIT - Engineering Laboratory Custodian \n●\u200b FREDERICK G. SIBUYO - Lab Technician / Custodian (Bachelor of Science in \nElectronics Technology) \n●\u200b CHRISTIANNE DOUGLAS H. UVERO - Lab Technician/Custodian (Computer Systems \nDesign & Programming)', '[GENERAL] CSEA Organizational Structure 1st sem SY 2025 2026\n\nOFFICE STAFF \n●\u200b FELIX B. GABO - Lab Technician/Custodian (Electronics & Communications \nTechnology) \n●\u200b DANILO C. ASIA JR. - Computer Lab Tech/Custodian (Computer System Network \nTechnology) \n●\u200b ERIKSON I. BERIDO - Computer Tech/Lab Custodian (Computer Technician Course) \n●\u200b MICHAEL T. DIAZ - Lab Technician/Custodian (Computer Technician)', '[GENERAL] ADNU Campus Directory\n\n-\u200b\nCollege of Science, Engineering and Architecture offices and classrooms \n-\u200b\nBIM Laboratory \n-\u200b\nSMART Laboratory \n-\u200b\nHydraulics Laboratory \n-\u200b\nComputer Modeling Laboratory \n-\u200b\nFluid Mechanics Lab \n-\u200b\nSoil Mechanics Lab \n-\u200b\nMaterials and Testing Lab \n-\u200b\nSurveying Lab \n-\u200b\nAll EB Rooms', '[GENERAL] CSEA Organizational Structure 1st sem SY 2025 2026\n\nECE & CpE DEPARTMENT \nCHAIRPERSON \nDR. CELESTE M. OJEDA \nDoctor of Philosophy in Electronics Engineering']",The retrieved documents do not contain this information.,A minimum GPA of 2.0 and the department chairperson's approval are required to shift to Computer Engineering.,0.0,0.0,1.0,0.013945585088971767,0.0,-6.958549499511719
Who is the chairperson of the Computer Engineering department?,"['[GENERAL] CSEA Organizational Structure 1st sem SY 2025 2026\n\nECE & CpE DEPARTMENT \nCHAIRPERSON \nDR. CELESTE M. OJEDA \nDoctor of Philosophy in Electronics Engineering', '[GENERAL] CSEA Organizational Structure 1st sem SY 2025 2026\n\nMATHEMATICS DEPARTMENT \n\nCHAIRPERSON \nMR. FRANCIS D. DELLORO \nDoctor of Philosophy in Mathematics \nFULL-TIME FACULTY \n●\u200b ENGELBERT T. BALOLOY - Master in Mathematics \n●\u200b SALVADOR H. BONITA, JR. - Bachelor of Science in Mathematics \n●\u200b ELOUIS GIANMAE S. CHENG - Master in Mathematics (on Study Leave) \n●\u200b MARIVIC F. DELLORO - Master in Mathematics \n●\u200b ERIC JAN M. ESCOBER - Master in Mathematics \n●\u200b GLENDA G. QUINTO - Master in Mathematics \n●\u200b MARY ALLYSA JENICA P. SARIBA - Bachelor of Secondary Education major in \nMathematics \nPART-TIME FACULTY \n●\u200b DR. FRANCIS D. DELLORO - Doctor of Philosophy in Mathematics \n●\u200b ENGR. GILBERT D. DETERA - Bachelor of Science in Electronics & Communications \nEngineering \n●\u200b ROGEL JOHN O. NAVAL - Bachelor of Science, Bachelor of Secondary Education Major \nin Mathematics \n●\u200b SOLOMON L. OLAYTA - Master in Mathematics', '[GENERAL] CSEA Organizational Structure 1st sem SY 2025 2026\n\nCHAIRPERSON \nENGR. GEORGETTE F. GESMUNDO \nBachelor of Science in Civil Engineering \nFULL-TIME FACULTY (Civil Engineering & Architecture) \n●\u200b AR. ROLITO AVILA JR. - Bachelor of Science in Architecture \n●\u200b ENGR. FERDINAND E. BIEN - Master of Science in Civil Engineering \n●\u200b AR. KEANE ALEJO L. COLLADA - Bachelor of Science in Architecture \n●\u200b ENGR. FRANCISCO S. CUETO - Bachelor of Science in Civil Engineering \n●\u200b AR. ALYANNA MARYA TRICIA M. DE VILLA - Bachelor of Science in Architecture \n●\u200b ENGR. MICHAEL M. REAL - Bachelor of Science in Civil Engineering \n●\u200b ENGR. KHIM CATHLEEN M. SADDI - Master in Engineering, major in Civil Engineering \n(on Study Leave) \n●\u200b AR. VIA MARIA M. SAN JOSE - Bachelor of Science in Architecture (on Study leave) \nPART-TIME FACULTY \n●\u200b ENGR. SALVADOR ALDECOA - Master of Science in Civil Engineering & Master \nMembrane Structures \n●\u200b AR. YOBERT P. BAÑAGA - Bachelor of Science in Architecture', '[GENERAL] CSEA Organizational Structure 1st sem SY 2025 2026\n\nCHAIRPERSON \nDR. MARIA AURORA A. CONDE \nDoctor of Philosophy in Plant Science \nFULL-TIME FACULTY \n●\u200b AMANDA S. DE LOS SANTOS - Master of Science in Environmental Science \n●\u200b DR. DONNABEL G. MAGNO - Doctor of Philosophy in Plant Science \n●\u200b CHERRY FAYE O. MALANYAON - Bachelor of Science in Biology \n●\u200b KATHRYN FAYE F. MENDOZA - Bachelor of Science in Biology \n●\u200b LEVIN JOHN B. OROPESA - Master in Biology \n●\u200b JUDY DEL VALLE PEREZ - Master of Chemistry \n●\u200b RAMONA M. RAMOS - Bachelor of Science in Biology \n●\u200b DR. MARLINDA S. REGONDOLA - Doctor of Philosophy in Science Education major in \nChemistry \n●\u200b DR. RAMONA S. RENEGADO - Doctor of Education \n●\u200b IAN R. SORIANO - Bachelor of Science in Secondary Education major in Physical \nSciences \n●\u200b EUNICE TURIANO - Bachelor of Science in Environmental Management \n●\u200b FRANCIS XAVIER D. VERDADERO - Master of Science in Biology (on study leave) \nPART-TIME FACULTY \n●\u200b MICHELLE N. DELFIN - Bachelor of Science major in Biology', '[GENERAL] CSEA Organizational Structure 1st sem SY 2025 2026\n\n●\u200b ENGR. RYAN ALVIN O. MERCADO - Master of Science in Electronics & \nCommunications Engineering \n●\u200b DR. CELESTE M. OJEDA - Doctor of Philosophy in Electronics Engineering \n●\u200b DR. REFERENDO D. SORIANO - Doctor of Philosophy in Electrical & Electronics \nEngineering \nOFFICE STAFF \n●\u200b GERALD P. BELANO - Lab Technician/Custodian (Bachelor of Science in Food \nTechnology) \n●\u200b DARYL SID F. REALUBIT - Engineering Laboratory Custodian \n●\u200b FREDERICK G. SIBUYO - Lab Technician / Custodian (Bachelor of Science in \nElectronics Technology) \n●\u200b CHRISTIANNE DOUGLAS H. UVERO - Lab Technician/Custodian (Computer Systems \nDesign & Programming)', '[GENERAL] CSEA Organizational Structure 1st sem SY 2025 2026\n\nFULL-TIME FACULTY \n●\u200b ENGR. ANACLETO A. CASIMIRO - Master of Science in Electronics & Communications \nEngineering \n●\u200b ELMER C. CLAVERIA JR. - Bachelor of Science in Computer Science \n●\u200b ENGR. EUGENE T. DY - Master of Science in Electronics Engineering \n●\u200b ENGR. CORNELIO G. LABRADOR II - Master of Science in Electronics and \nCommunications Engineering \n●\u200b DR. JOEL R. NOCHE - Doctor of Philosophy in Education major in Mathematics \n●\u200b ENGR. CARLO GIOVANNI E. OLIVAN - Bachelor of Science in Computer Engineering \n(on study leave) \n●\u200b ENGR. JEAN PAUL I. PAJE - Master of Physics \n●\u200b ENGR. KARLA LOUISSA MARIE D. SOBREVILLA - Master of Engineering in Computer \nEngineering \nPART-TIME FACULTY \n●\u200b ENGR. FRANCISCO S. CUETO - Bachelor of Science in Civil Engineering \n●\u200b ENGR. GEORGETTE F. GESMUNDO - Bachelor of Science in Civil Engineering \n●\u200b ENGR. RYAN ALVIN O. MERCADO - Master of Science in Electronics & \nCommunications Engineering', '[GENERAL] CSEA Organizational Structure 1st sem SY 2025 2026\n\nOFFICE STAFF \n●\u200b FELIX B. GABO - Lab Technician/Custodian (Electronics & Communications \nTechnology) \n●\u200b DANILO C. ASIA JR. - Computer Lab Tech/Custodian (Computer System Network \nTechnology) \n●\u200b ERIKSON I. BERIDO - Computer Tech/Lab Custodian (Computer Technician Course) \n●\u200b MICHAEL T. DIAZ - Lab Technician/Custodian (Computer Technician)', '[GENERAL] CSEA Organizational Structure 1st sem SY 2025 2026\n\nCIVIL ENGINEERING & ARCHITECTURE \nDEPARTMENT']",The retrieved documents do not contain this information.,Engr. Celeste M. Ojeda is the chairperson of the Computer Engineering department.,0.9999999999,0.0,1.0,0.029546784204207057,0.0,2.7619433403015137
What is the required OJT hours for CpE students?,"[""**BS CPE — FIRST YEAR**\n\n## FIRST YEAR\r\n\n## BS CPE — First Year — 1st SEMESTER\r\n| CODE | TITLE | CREDIT UNIT | PAY UNIT LEC | PAY UNIT LAB | CO- /PRE- REQUISITE COURSE CODE | COURSE TITLE |\r\n|---|---|---|---|---|---|---|\r\n| CRPC001 | College SRA 1 | [1.5] | 1.5 | 0 | None | None |\r\n| CIFP101 | Ateneo Culture and Spirituality | [1.5] | 1.5 | 0 | None | None |\r\n| PFit101 | Physical Activities Toward Health and Fitness 1 | 2 | 2 | 0 | None | None |\r\n| NSCS101 | Science, Technology & Society | 3 | 3 | 0 | None | None |\r\n| ENGS101 | Purposive Communication | 3 | 3 | 0 | None | None |\r\n| THEN100 | Introduction to Catholic Faith (Required for graduates of Non-Catholic SHS) | | 3 | 0 | None | None |\r\n| PHIS101 | Understanding the Self | 3 | 3 | 0 | None | None |\r\n| GESC111 | Chemistry for Engineers Lecture | 3 | 3 | 0 | CO- GESC112 | Chemistry for Engineers Laboratory |\r\n| GESC112 | Chemistry for Engineers Laboratory | 1 | 0 | 3 | CO- GESC111 | Chemistry for Engineers Lecture |\r\n| GEMT100 | Basic Engineering Mathematics | 5 | 5 | 0 | CO- GEMT101 | Engineering Calculus 1: Differential Calculus |\r\n| GEMT101 | Engineering Calculus 1: Differential Calculus | 3 | 3 | 0 | CO- GEMT100 | Basic Engineering Mathematics |\r\n| QCPP210 | Computer Engineering as a Discipline | 1 | 1 | 0 | None | None |\r\n| None | Subtotal | None | 29 | 3 | None | None |\r\n| None | Total (Pay units will be a total of 26 units for graduates of Catholic SHS) | 24 | 32 | None | None | None |\r\n\n## BS CPE — First Year — 2nd SEMESTER\r\n| CODE | TITLE | CREDIT UNIT | PAY UNIT LEC | PAY UNIT LAB | CO- /PRE- REQUISITE COURSE CODE | COURSE TITLE |\r\n|---|---|---|---|---|---|---|\r\n| CRCP002 | College SRA 2 | [1.5] | 1.5 | 0 | None | None |\r\n| CIFP102 | ADNU's Social Mission and Formation | [1.5] | 1.5 | 0 | CIFP101 | Ateneo Culture and Spirituality |\r\n| PFit102 | Physical Activities Toward Health and Fitness 2 | 2 | 2 | 0 | PFit101 | Physical Activities Toward Health and Fitness 1 |\r\n| SOCS101 | Art Appreciation | 3 | 3 | 0 | None | None |\r\n| MTHS101 | Mathematics for the Modern World | 3 | 3 | 0 | None | None |\r\n| THEN101 | Christian Discipleship Today (No pre-requisite required if graduated from Catholic SHS) | 3 | 3 | 0 | PRE- THEN100 | Introduction to Catholic Faith |\r\n| PHIN101 | Logical and Critical Thinking (No pre-requisite required if graduated from Catholic SHS) | 3 | 3 | 0 | PRE- PHIS101 | Understanding the Self |\r\n| QCPP010 | Engineering Discrete Mathematics | 3 | 3 | 0 | PRE- GEMT101, CO- QCPP310 | Engineering Calculus 1: Differential Calculus, Programming Logic and Design |\r\n| GESC211 | Engineering Physics 1 Lecture | 3 | 3 | 0 | PRE- GEMT101, CO- GESC 212 | Engineering Calculus 1: Differential Calculus, Engineering Physics 1 Laboratory |\r\n| GESC212 | Engineering Physics 1 Laboratory | 1 | 0 | 3 | PRE- GEMT101, CO- GESC 211 | Engineering Calculus 1: Differential Calculus, Engineering Physics 1 Lecture |\r\n| GEMT102 | Engineering Calculus 2: Integral Calculus | 3 | 3 | 0 | PRE- GEMT100, GEMT101 | Basic Engineering Mathematics, Engineering Calculus 1: Differential Calculus |\r\n| QCPP310 | Programming Logic and Design | 2 | 0 | 6 | CO- QCPP010 | Engineering Discrete Mathematics |\r\n| None | Subtotal | None | 26 | 9 | None | None |\r\n| None | Total | 26 | 35 | None | None | None |"", ""**BS CPE — SECOND YEAR**\n\n## SECOND YEAR\r\n\n## BS CPE — Second Year — 1st SEMESTER\r\n| CODE | TITLE | CREDIT UNIT | PAY UNIT LEC | PAY UNIT LAB | CO- /PRE- REQUISITE COURSE CODE | COURSE TITLE |\r\n|---|---|---|---|---|---|---|\r\n| CRCP003 | College SRA 3 | [1.5] | 1.5 | 0 | None | None |\r\n| NSTP001 | National Service Training Program (CWTS) 1 | 3 | 3 | 0 | PRE- CIFP102 | ADNU's Social Mission and Formation |\r\n| SOCS102 | Reading in Philippine History | 3 | 3 | 0 | None | None |\r\n| None | GE Elective 1 | 3 | 3 | None | None | None |\r\n| PHIN102 | Philosophical Anthropology | 3 | 3 | 0 | PRE- PHIN101 | Logical and Critical Thinking |\r\n| QCPP323 | Object - Oriented Programming (with Laboratory Fee; Upon completion of Object - Oriented Programming and Design, students can opt to apply for the following globally - recognized Professional Certifications: C++ Certified Professional Programmer (CPP) and Python Certified Associate Programmer (PCAP)) | 2 | 0 | 6 | PRE- QCPP310 | Programming Logic and Design |\r\n| QCPA211 | Fundamentals of Electrical Circuits Lecture | 3 | 3 | 0 | PRE- GESC211, GESC212, CO- QCPA212 | Engineering Physics 1 Lecture, Engineering Physics 1 Laboratory, Fundamentals of Electrical Circuits Laboratory |\r\n| QCPA212 | Fundamentals of Electrical Circuits Laboratory | 1 | 0 | 3 | PRE- GESC211, GESC212, CO- QCPA211 | Engineering Physics 1 Lecture, Engineering Physics 1 Laboratory, Fundamentals of Electrical Circuits Lecture |\r\n| QEMT103 | Differential Equations for ECE/CpE | 3 | 3 | 0 | PRE- GEMT 102 | Engineering Calculus 2: Integral Calculus |\r\n| QECC101 | CAD 1: Fundamentals of CAD | 1 | 0 | 3 | None | 2nd Year Standing |\r\n| GEAL101 | Engineering Data Analysis (with Laboratory Fee) | 3 | 3 | 0 | PRE- GEMT101 | Engineering Calculus 1: Differential Calculus |\r\n| None | Subtotal | None | 22.5 | 12 | None | None |\r\n| None | Total | 25 | 34.5 | None | None | None |\r\n\n## BS CPE — Second Year — 2nd SEMESTER\r\n| CODE | TITLE | CREDIT UNIT | PAY UNIT LEC | PAY UNIT LAB | CO- /PRE- REQUISITE COURSE CODE | COURSE TITLE |\r\n|---|---|---|---|---|---|---|\r\n| CRCP004 | College SRA 4 | [1.5] | 1.5 | 0 | None | None |\r\n| NSTP102 | National Service Training Program (CWTS) 2 | 3 | 3 | 0 | PRE- NSTP101 | National Service Training Program (CWTS) 1 |\r\n| SOCS103 | The Contemporary World | 3 | 3 | 0 | PRE- SOCS102 | Reading in Philippine History |\r\n| None | GE Elective 2* | 3 | 3 | 0 | None | None |\r\n| PHIS102 | Ethics | 3 | 3 | 0 | PRE- PHIN102 | Philosophical Anthropology |\r\n| QCPP330 | Data Structures and Algorithm Analysis | 2 | 0 | 6 | PRE- QCPP323 | Object - Oriented Programming |\r\n| QCPP020 | Numerical Methods and Analysis | 4 | 3 | 3 | PRE- QEMT103 | Differential Equations for ECE/CpE |\r\n| QCPA221 | Fundamentals of Electronic Circuits Lecture | 3 | 3 | 0 | PRE- QCPA211, QCPA212, CO- QCPA222 | Fundamentals of Electrical Circuits Lecture, Fundamentals of Electrical Circuits Laboratory, Fundamentals of Electronic Circuits Laboratory |\r\n| QCPA222 | Fundamentals of Electronic Circuits Laboratory | 1 | 0 | 3 | PRE- QCPA211, QCPA212, CO- QCPA221 | Fundamentals of Electrical Circuits Lecture, Fundamentals of Electrical Circuits Laboratory, Fundamentals of Electronic Circuits Lecture |\r\n| GEAL102 | Engineering Economics | 3 | 3 | 0 | PRE- GEAL101 | Engineering Data Analysis |\r\n| None | Subtotal | None | 22.5 | 12 | None | None |\r\n| None | Total | 25 | 34.5 | None | None | None |"", ""**BS ECE — 4th year**\n\n## 4th year\r\n\n## BS ECE — Fourth Year — 1st Semester\r\n| Course Code | Course Title | Units | Pay Units Lec | Pay Units Lab | Co-requisites | Prerequisites |\r\n|---|---|---|---|---|---|---|\r\n| None | GEC Elective 2 (Non-Credit Subject (Optional): Upon completion of ALL Computer Networks Professional Electives, QECE001, QECE002, QECE003, students can opt to apply for certifications: Cisco Certified Networking Associate (CCNA)) | 3 | 3 | 0 | None | none |\r\n| SOCS102 | Reading in Philippine History | 3 | 3 | 0 | None | none |\r\n| QECC040 | Seminars/ Colloquium/Fieldtrips | 1 | 0 | 3 | None | Fourth Year Standing |\r\n| QECC220 | Engineering Design 1 /Capstone Project 1 | 1 | 0 | 3 | None | QECC010, GEAL102, QECC210 |\r\n| QECP441 | Engineering Communication 4 Lecture: Data Communications | 3 | 3 | 0 | QECP442 | QECP421, QECP422 |\r\n| QECP442 | Engineering Communication 4 Laboratory: Data Communications | 1 | 0 | 3 | QECP441 | QECP421, QECP422 |\r\n| QECP431 | Engineering Communication 3 Lecture: Transmission Media and Antenna System | 3 | 3 | 0 | QECP432 | QECP411, QECP412, QECP020 |\r\n| QECP432 | Engineering Communication 3 Laboratory: Transmission Media and Antenna System | 1 | 0 | 3 | QECP431 | QECP411, QECP412, QECP020 |\r\n| GEAL103 | Engineering Management | 2 | 2 | 0 | None | None |\r\n| QECE003 | Professional Elective 3 (Non-Credit Subject (Optional): Upon completion of ALL Computer Networks Professional Electives, QECE001, QECE002, QECE003, students can opt to apply for certifications: Cisco Certified Networking Associate (CCNA)) | | | | None | QECE002 |\r\n| None | Total Number of Units | 18 | 26 | None | None | None |\r\n\n## BS ECE — Fourth Year — 2nd Semester\r\n| Course Code | Course Title | Units | Pay Units Lec | Pay Units Lab | Co-requisites | Prerequisites |\r\n|---|---|---|---|---|---|---|\r\n| None | GEC Elective 3 (Maybe credited as GE Elective) | 3 | 3 | 0 | None | None |\r\n| SOCS103 | The Contemporary World | 3 | 3 | 0 | None | SOCS102 |\r\n| SOCS104 | The Life and Works of Rizal | 3 | 3 | 0 | None | None |\r\n| THEN103 | Christian Vocation: Love, Family Life and Society (Maybe credited as GE Elective) | 3 | 3 | 0 | None | THEN102, PHIN103 |\r\n| QECC020 | ECE/CpE Laws, Contracts, Ethics & Standards | 3 | 3 | 0 | None | PHIS102 |\r\n| QECC230 | Engineering Design 2 /Capstone Project 2 | 2 | 0 | 6 | None | QECC220 |\r\n| None | Professional Elective 4 | 4 | 3 | 3 | None | Fourth Year Standing |\r\n| None | Professional Elective 5 | 4 | 3 | 3 | None | Fourth Year Standing |\r\n| None | Total Number of Units | 25 | 33 | None | None | None |\r\n\n## Professional Electives\r\n\n| Course Code | Course Title | Units | Prerequisites |\r\n|---|---|---|---|\r\n| QECE001 | Computer Networks 1 | 4 | QECE001 |\r\n| QECE002 | Computer Networks 2 | 4 | QECE002 |\r\n| QECE003 | Computer Networks 3 | 4 | QCP431, QCP432 |\r\n| QECE450 | Advanced Communication System & Design | 4 | QECP431, QECP432, QECP441, QECP442 |\r\n| QECE460 | Advanced Networking | 4 | QECP131, QECP132, QECP020 |\r\n| QECE140 | Advanced Power Supply Systems | 4 | QECP511, QECP512 |\r\n| QECE520 | Advanced Instrumentation and Control | 4 | QECP310 |\r\n| QECE320 | Advanced DSP | 4 | None |\r\n| QECE005 | Internet of Things (IoT) Fundamentals | 4 | None |\r\n\n## Others:\r\n1. Introduction to Catholic Faith: Non-credit, required for all non-Catholic and graduates of non-Catholic Senior High School before taking THEN101.\r\n2. Two required Jesuit Core Courses, namely THEN103 (Christian: Love, Family Life, and Society) and PHIN101 (Logical and Critical Thinking), as developed, comply with the criteria for the design of GE Elective Courses. As such, students may also opt to have any of these courses credited as a GE Elective. Consequently, the total credit units earned may be reduced by the same number of Jesuit Core units credited towards the required GE Electives.\r\n3. The College SRA must be finished within the first two curriculum years.\r\n4. Seniors' Retreat and Community Outreach Program are requirements for graduation."", ""**BS ECE — 1st year**\n\n## 1st year\r\n\n## BS ECE — First Year — 1st Semester\r\n| Course Code | Course Title | Units | Pay Units Lec | Pay Units Lab | Co-requisites | Prerequisites |\r\n|---|---|---|---|---|---|---|\r\n| CRCP001 | SRA Reading Program1 | [1.5] | 1.5 | 0 | None | None |\r\n| CIFP101 | ADNU Culture and Spirituality | [1.5] | 1.5 | 0 | None | None |\r\n| PFit101 | Physical Activities Toward Health and Fitness 1 | 2 | 2 | 0 | None | None |\r\n| NSCS101 | Science, Technology & Society | 3 | 3 | 0 | None | None |\r\n| SOCS101 | Art Appreciation | 3 | 3 | 0 | None | None |\r\n| THEN100 | Introduction to Catholic Faith (Required for graduates of Non-Catholic SHS) | | 3 | 0 | None | None |\r\n| PHIS101 | Understanding the Self | 3 | 3 | 0 | None | None |\r\n| GESC111 | Chemistry for Engineers Lecture | 3 | 3 | 0 | GESC112 | None |\r\n| GESC112 | Chemistry for Engineers Laboratory | 1 | 0 | 3 | GESC111 | None |\r\n| GEMT100 | Basic Engineering Mathematics | 5 | 5 | 0 | GEMT101 | None |\r\n| GEMT101 | Engineering Calculus 1: Differential Calculus | 3 | 3 | 0 | GEMT100 | None |\r\n| QECC101 | CAD 1: Fundamentals of CAD | 1 | 0 | 3 | None | None |\r\n| None | Total Number of Units | 24 | 28 | 6 | None | None |\r\n\n## BS ECE — First Year — 2nd Semester\r\n| Course Code | Course Title | Units | Pay Units Lec | Pay Units Lab | Co-requisites | Prerequisites |\r\n|---|---|---|---|---|---|---|\r\n| CRCP002 | SRA Reading Program2 | [1.5] | 1.5 | 0 | None | None |\r\n| CIFP102 | ADNU's Social Mission and Formation | [1.5] | 1.5 | 0 | None | CIFP101 |\r\n| PFit102 | Physical Activities Toward Health and Fitness 2 | 2 | 2 | 0 | None | PFit101 |\r\n| MTHS101 | Mathematics for Modern world | 3 | 3 | 0 | None | none |\r\n| THEN101 | Christian Discipleship Today (Graduate of Non-Catholic SHS must have passed THEN100 before taking THEN101) | 3 | 3 | 0 | None | THEN100 |\r\n| PHIN101 | Logical and Critical Thinking (May be credited as GE Elective) | 3 | 3 | 0 | None | PHIS101 |\r\n| QECA020 | Material Science and Engineering | 3 | 3 | 0 | None | GESC111, GESC112 |\r\n| GESC211 | Engineering Physics 1 Lecture | 3 | 3 | 0 | GESC212, GEMT102 | GEMT101 |\r\n| GESC212 | Engineering Physics 1 Laboratory | 1 | 0 | 3 | GESC211, GEMT102 | GEMT101 |\r\n| GEMT102 | Engineering Calculus 2: Integral Calculus | 3 | 3 | 0 | None | GEMT100, GEMT101 |\r\n| QECA221 | Engineering Physics 2 Lecture: Physics for ECE | 3 | 3 | 0 | GESC211, GESC212, QECA221 | GEMT101 |\r\n| QECA222 | Engineering Physics 2 Laboratory: Physics for ECE | 1 | 0 | 3 | GESC211, GESC211, QECA221 | GEMT101 |\r\n| QECA030 | Environmental Sciences & Engineering | 3 | 3 | 0 | None | GESC111, GESC112 |\r\n| None | Total Number of Units | 28 | 35 | None | None | None |"", '**BS CE — 2nd Year**\n\n## 2nd Year\r\n\n## BS CE — Second Year — 1st Semester\r\n| Course Code | Course Title | Units | Pay Units Lec | Pay Units Lab | Co-requisite | Prerequisites |\r\n|---|---|---|---|---|---|---|\r\n| CRCP003 | SRA Reading Program3 | [1.5] | 1.5 | 0 | None | None |\r\n| NSTP101 | National Service Training Program (CWTS) 1 | 3 | 3 | 0 | None | CIFP102 |\r\n| PFit103 | Physical Activities Toward Health and Fitness 3 | 2 | 2 | 0 | None | PFit101, PFit102 |\r\n| None | GEC Elective 1 | 3 | 3 | 0 | None | None |\r\n| ENGS101 | Purposive Communication | 3 | 3 | 0 | None | none |\r\n| PHIN102 | Philosophical Anthropology | 3 | 3 | 0 | None | PHIN101 |\r\n| GEAL101 | Engineering Data Analysis (Without Laboratory Fee, will be assigned in Lecture Rooms) | 3 | 3 | 0 | None | GEMT101 |\r\n| CENG213 | Statics of Rigid Bodies | 3 | 3 | 0 | None | GESC212, GEMT102 |\r\n| GEMT103 | Differential Equations | 3 | 3 | 0 | None | GEMT102 |\r\n| CENG313 | Geology for Civil Engineering | 2 | 2 | 0 | None | GESC111, GESC112 |\r\n| CENG217 | Hydrology | 2 | 2 | 0 | None | GEMT102 |\r\n| None | Total Number of Units | 27 | 28.5 | 0 | None | None |\r\n\n## BS CE — Second Year — 2nd Semester\r\n| Course Code | Course Title | Units | Pay Units Lec | Pay Units Lab | Co-requisite | Prerequisites |\r\n|---|---|---|---|---|---|---|\r\n| CRCP004 | SRA Reading Program4 | [1.5] | 1.5 | 0 | None | None |\r\n| NSTP102 | National Service Training Program (CWTS) 2 | 3 | 3 | 0 | None | NSTP101 |\r\n| PFit104 | Physical Activities Toward Health and Fitness 4 | 2 | 2 | 0 | None | PFit101, PFit102, PFit103 |\r\n| SOCS102 | Reading in Philippine History | 3 | 3 | 0 | None | none |\r\n| PHIS102 | Ethics | 3 | 3 | 0 | None | PHIN102 |\r\n| CENG227 | Fundamentals of Surveying LEC | 3 | 3 | 0 | CENG228 | CENG123 |\r\n| CENG228 | Fundamentals of Surveying LAB | 1 | 0 | 3 | CENG227 | CENG123 |\r\n| CENG224 | Mechanics of Deformable Bodies | 4 | 4 | 0 | None | CENG213 |\r\n| CENG223 | Dynamics of Rigid Bodies | 2 | 2 | 0 | None | CENG213 |\r\n| CENG228 | Computer Aided-Drafting | 1 | 0 | 3 | None | CENG123 |\r\n| GEAL102 | Engineering Economics | 3 | 3 | 0 | None | GEMT102 |\r\n| None | Total Number of Units | 25 | 24.5 | 6 | None | None |', '**BS EM — FOURTH YEAR**\n\n## FOURTH YEAR\r\n\n## BS EM — Fourth Year — 1st SEMESTER\r\n| Course Code | Course Title | Credit Units Lec | Credit Units Lab | Pay units Lec | Pay units Lab | Pre-Requisite Course Code | Pre-Requisite Course Title |\r\n|---|---|---|---|---|---|---|---|\r\n| ENME___ | Environmental Management Elective I (Lecture) | 3 | 0 | 3 | 0 | None | Pass all Major Subjects |\r\n| ENME___ | Environmental Management Elective I (Laboratory) | 0 | 2 | 0 | 6 | None | Pass all Major Subjects |\r\n| ENME___ | Environmental Management Elective II | 3 | 0 | 3 | 0 | None | Pass all Major Subjects |\r\n| ENME___ | Environmental Management Elective III | 3 | 0 | 3 | 0 | None | Pass all Major Subjects |\r\n| RESE492 | Thesis II | 2 | 0 | 2 | 0 | RESE391 | Thesis 1 |\r\n| None | Free Elective I (Required Elective for all) | 3 | 0 | 3 | 0 | None | None |\r\n| None | NGEC Elective 1 (Six (6) of the nine (9) units of GE Electives shall be earmarked for the required six (6) units of Filipino courses. This is in compliance with CMO No. 57, Series of 2017 issued by CHED in response to the Temporary Restraining Order (TRO) issued by the Supreme Court. GE Elective 1 shall be replaced by FILS102 (Dalumat ng/sa Filipino) and GE Elective 2 by FILS103 (Sosyedad at Literatura/PanitikangPanlipunan) or FILS 104 (Sinesosyedad/PelikulangPanlipunan). This arrangement shall be revisited once the TRO is finally settled.) | 3 | 0 | 3 | 0 | None | None |\r\n| None | NGEC Elective 2 | 3 | 0 | 3 | 0 | None | None |\r\n| None | TOTAL | 20 | 2 | 20 | 6 | None | None |\r\n\n## BS EM — Fourth Year — 2nd SEMESTER\r\n| Course Code | Course Title | Credit Units Lec | Credit Units Lab | Pay units Lec | Pay units Lab | Pre-Requisite Course Code | Pre-Requisite Course Title |\r\n|---|---|---|---|---|---|---|---|\r\n| ENME___ | Environmental Management Elective IV (Lecture) | 3 | 0 | 3 | 0 | None | Pass all Major Subjects |\r\n| ENME___ | Environmental Management Elective IV (Laboratory) | 0 | 2 | 0 | 6 | None | Pass all Major Subjects |\r\n| ENME___ | Environmental Management Elective V | 3 | 0 | 3 | 0 | None | Pass all Major Subjects |\r\n| RESE493 | Thesis III | 2 | 0 | 2 | 0 | RESE492 | Thesis II |\r\n| None | Free Elective 2 (Required Elective for all) | 3 | 0 | 3 | 0 | None | None |\r\n| None | CHED NGEC Elective 3 | 3 | 0 | 3 | 0 | None | None |\r\n| THEN103 | Christian Vocation: Christian Vocation, Love, Family Life and Society | 3 | 0 | 3 | 0 | THEN102, PHIN103 | Christian Moral Paradigm, Philosophy of Religion |\r\n| None | TOTAL | 17 | 2 | 17 | 6 | None | None |', '[GENERAL] 2025 ADNU COLLEGE HANDBOOK   CHAPTER 1\n\n4\n\nStudent Handbook 2025-2026__INSIDE.indd 168 8/20/25 1:43PM', ""**BS CE — 1st Year**\n\n## 1st Year\r\n\n## BS CE — First Year — 1st Semester\r\n| Course Code | Course Title | Units | Pay Units Lec | Pay Units Lab | Co-requisite | Prerequisites |\r\n|---|---|---|---|---|---|---|\r\n| CRCP001 | SRA Reading Program1 | [1.5] | 1.5 | 0 | None | None |\r\n| CIFP101 | ADNU Culture and Spirituality | [1.5] | 1.5 | 0 | None | None |\r\n| PFit101 | Physical Activities Toward Health and Fitness 1 | 2 | 2 | 0 | None | None |\r\n| NSCS101 | Science, Technology & Society | 3 | 3 | 0 | None | None |\r\n| SOCS101 | Art Appreciation | 3 | 3 | 0 | None | None |\r\n| THEN100 | Introduction to Catholic Faith (Required for graduates of Non-Catholic SHS) | | 3 | 0 | None | None |\r\n| PHIS101 | Understanding the Self | 3 | 3 | 0 | None | None |\r\n| GESC111 | Chemistry for Engineers Lecture | 3 | 3 | 0 | GESC112 | None |\r\n| GESC112 | Chemistry for Engineers Laboratory | 1 | 0 | 3 | GESC111 | None |\r\n| GEMT100 | Basic Engineering Mathematics | 5 | 5 | 0 | GEMT101 | None |\r\n| GEMT101 | Engineering Calculus 1: Differential Calculus | 3 | 3 | 0 | GEMT100 | None |\r\n| CENG113 | Civil Engineering Orientation | 2 | 2 | 0 | None | None |\r\n| None | Total Number of Units | 25 | 30 | 3 | None | None |\r\n\n## BS CE — First Year — 2nd Semester\r\n| Course Code | Course Title | Units | Pay Units Lec | Pay Units Lab | Co-requisite | Prerequisites |\r\n|---|---|---|---|---|---|---|\r\n| CRCP002 | SRA Reading Program2 | [1.5] | 1.5 | 0 | None | None |\r\n| CIFP102 | ADNU's Social Mission and Formation | [1.5] | 1.5 | 0 | None | CIFP101 |\r\n| PFit102 | Physical Activities Toward Health and Fitness 2 | 2 | 2 | 0 | None | PFit101 |\r\n| MTHS101 | Mathematics in the Modern World | 3 | 3 | 0 | None | none |\r\n| THEN101 | Christian Discipleship Today | 3 | 3 | 0 | None | THEN100 |\r\n| PHIN101 | Logical and Critical Thinking | 3 | 3 | 0 | None | PHIS101 |\r\n| CENG123 | Engineering Drawings and Plans | 1 | 0 | 3 | None | none |\r\n| GESC211 | Engineering Physics 1 Lecture | 3 | 3 | 0 | GESC212, GEMT102 | GEMT101 |\r\n| GESC212 | Engineering Physics 1 Laboratory | 1 | 0 | 3 | GESC211, GEMT102 | GEMT101 |\r\n| GEMT102 | Engineering Calculus 2: Integral Calculus | 3 | 3 | 0 | None | GEMT101, GEMT100 |\r\n| COMP124 | CE: Computer Fundamentals and Programming | 2 | 0 | 6 | None | None |\r\n| None | Total Number of Units | 21 | 20 | 12 | None | None |""]",The retrieved documents do not contain this information.,Computer Engineering students are required to complete 240 hours of On-the-Job Training.,0.0,0.0,0.0,0.019724557624161233,0.0,-6.157358646392822
